id,name,distance,moving_time,type,average_speed,start_date,total_elevation_gain,gear_id,average_heartrate,elapsed_time,kilojoules,calories,average_cadence,average_watts,weighted_average_watts,sport_type
8097015786,Afternoon Ride,38955.9,1:37:45,Ride,6.642,2010-07-24 18:55:48+00:00,50.7,b1683032,153.2,9:07:47,1071.7,,,182.7,,Ride
8097011734,Evening Ride,39269.5,1:07:59,Ride,9.627,2010-07-25 22:26:20+00:00,32.7,b1683032,157.8,3:37:03,1005.4,,,246.5,,Ride
8096969394,Evening Run,2788.9,0:23:15,Run,1.999,2010-08-31 23:50:00+00:00,3.8,g3714779,135.5,0:24:54,,,,,,Run
8096965882,Lunch Ride,19381.1,0:59:28,Ride,5.432,2010-09-11 16:01:20+00:00,33.8,b1683032,139.7,"1 day, 7:38:50",279.2,,,78.3,,Ride
8096973590,Morning Run,4719.3,0:39:22,Run,1.998,2010-11-20 14:45:18+00:00,3.7,g3714779,152.0,0:40:15,,,,,,Run
8096998209,Afternoon Ride,25910.8,1:07:10,Ride,6.429,2011-04-30 19:05:54+00:00,21.9,b1683032,124.5,1:07:31,685.6,,,170.1,,Ride
8096995537,Afternoon Ride,41039.6,1:38:07,Ride,6.971,2011-05-12 21:20:45+00:00,54.9,b1683032,149.6,1:40:48,1174.3,,,199.5,,Ride
8096989436,Morning Ride,53945.3,2:10:24,Ride,6.895,2011-07-30 12:29:43+00:00,56.4,b1683032,156.3,2:20:54,1517.1,,,193.9,,Ride
393712245,Evening Ride,19370.3,0:47:20,Ride,6.821,2012-07-11 22:08:06+00:00,12.6,b1683032,148.3,1:48:16,600.4,,,211.4,,Ride
393712256,Evening Ride,63373.2,2:29:22,Ride,7.071,2012-07-30 23:40:58+00:00,25.9,b1683032,154.4,"3 days, 0:22:29",1950.3,,,217.6,,Ride
393712259,Morning Ride,76010.4,3:08:11,Ride,6.732,2012-08-04 10:54:32+00:00,60.1,b1683032,151.3,"1 day, 15:42:18",2235.2,,,198.0,,Ride
393712254,Night Ride,0.0,0:00:00,Ride,0.0,2012-08-06 02:37:01+00:00,0.0,b1683032,,0:06:57,0.0,,,0.0,,Ride
393712253,Night Ride,175.5,0:02:05,Ride,1.404,2012-08-06 02:43:58+00:00,0.0,b1683032,111.8,0:48:05,3.4,,,27.5,,Ride
393712269,Night Ride,74072.4,3:10:15,Ride,6.489,2012-08-08 02:13:08+00:00,58.8,b1683032,157.3,"26 days, 22:49:55",2164.2,,,189.6,,Ride
393712263,Morning Ride,64421.9,2:20:15,Ride,7.656,2012-09-08 12:46:05+00:00,46.6,b1683032,158.5,"7 days, 2:40:26",2089.0,,,248.3,,Ride
393712266,Lunch Ride,56939.9,2:13:56,Ride,7.086,2012-09-15 15:26:31+00:00,26.3,b1683032,161.9,4:19:50,1734.2,,,215.8,,Ride
393712224,Lunch Run,1845.1,0:18:04,Run,1.702,2012-10-22 16:09:18+00:00,0.0,,,0:18:04,,,,,,Run
393712215,Afternoon Run,0.5,0:00:00,Run,0.0,2012-10-22 19:27:28+00:00,0.0,,,0:00:13,,,,,,Run
393712216,Afternoon Run,4850.8,0:25:11,Run,3.21,2012-10-22 19:31:07+00:00,0.0,,,0:25:48,,,,,,Run
393712209,Morning Run,2630.0,0:04:13,Run,10.395,2012-11-17 12:43:21+00:00,0.0,,69.6,0:06:56,,,,,,Run
393712212,Morning Run,322.0,0:02:22,Run,2.268,2012-11-17 14:50:17+00:00,0.0,,124.5,0:03:13,,,,,,Run
393712250,Lunch Run,2748.5,0:27:27,Run,1.669,2012-12-23 17:38:06+00:00,0.0,,,0:30:15,,,,,,Run
226583696,"05/31/2013 Midland, Michigan",1461.2,0:03:44,Ride,6.523,2013-05-31 22:19:14+00:00,0.0,,118.9,"2 days, 0:37:09",,,,,,Ride
226583712,"06/02/2013 Midland, Michigan",28474.1,1:06:03,Ride,7.185,2013-06-02 22:59:15+00:00,10.5,,141.1,1:06:24,,,,,,Ride
226583683,06/06/2013,0.0,0:00:05,Run,0.0,2013-06-06 17:17:00+00:00,0.0,,,0:00:05,,,,,,Run
226583713,"06/06/2013 Midland, Michigan",2314.3,0:27:10,Run,1.42,2013-06-06 17:19:22+00:00,0.0,,,0:48:25,,,,,,Run
226583702,"06/07/2013 Midland, Michigan",2943.6,0:13:18,Ride,3.689,2013-06-07 19:03:59+00:00,0.0,,,0:16:18,,,,,,Ride
226583701,"06/15/2013 Midland, Michigan",18759.9,0:47:12,Ride,6.624,2013-06-15 17:10:07+00:00,0.0,,155.0,0:52:56,,,,,,Ride
226583703,"06/22/2013 Midland, Michigan",47132.5,1:53:52,Ride,6.899,2013-06-22 15:40:00+00:00,10.6,,167.4,"3 days, 6:26:23",,,,,,Ride
226583700,"06/25/2013 Midland, Michigan",46010.0,1:57:09,Ride,6.546,2013-06-25 22:06:26+00:00,24.0,,145.3,2:06:43,,,,,,Ride
226583689,"07/02/2013 Midland, Michigan",37137.4,1:25:33,Ride,7.235,2013-07-02 22:03:22+00:00,12.7,,158.7,1:25:52,,,,,,Ride
226583697,"07/05/2013 Midland, Michigan",74312.8,2:58:10,Ride,6.952,2013-07-05 17:47:47+00:00,58.1,,153.9,3:36:40,,,,,,Ride
226583694,"07/26/2013 Midland, Michigan",36299.7,1:21:45,Ride,7.401,2013-07-26 21:39:00+00:00,13.3,,163.1,"3 days, 0:42:42",,,,,,Ride
226583691,"07/29/2013 Midland, Michigan",43056.3,1:48:46,Ride,6.598,2013-07-29 22:21:45+00:00,12.4,,151.0,2:05:21,,,,,,Ride
226583670,"08/13/2013 Midland, Michigan",17396.0,0:38:15,Ride,7.58,2013-08-13 21:56:41+00:00,0.0,,166.5,1:45:40,,,,,,Ride
226583682,"08/16/2013 Midland, Michigan",56545.4,2:14:28,Ride,7.009,2013-08-16 21:28:51+00:00,22.9,,158.7,2:15:49,,,,,,Ride
226583678,"08/17/2013 Midland, Michigan",66451.8,2:39:42,Ride,6.935,2013-08-17 17:49:06+00:00,60.4,,160.5,3:48:53,,,,,,Ride
226583664,"08/23/2013 Mackinaw City, Michigan",36.9,0:00:08,Run,4.613,2013-08-23 15:37:46+00:00,0.0,,,0:00:08,,,,,,Run
226583665,"08/23/2013 Mackinac Island, Michigan",48.9,0:00:12,Run,4.075,2013-08-23 16:36:31+00:00,0.0,,,0:00:12,,,,,,Run
226583673,"08/23/2013 Mackinac Island, Michigan",17031.6,1:30:00,Run,3.154,2013-08-23 16:38:51+00:00,49.5,,,8:11:12,,,,,,Run
226583674,"08/24/2013 Empire, Michigan",6783.8,1:25:04,Run,1.329,2013-08-24 16:26:40+00:00,165.4,,,4:06:38,,,,,,Run
226583671,"08/28/2013 Midland, Michigan",55679.4,2:05:52,Ride,7.373,2013-08-28 22:44:53+00:00,23.6,,161.5,2:06:46,,,,,,Ride
226583675,"08/31/2013 Midland, Michigan",73582.7,2:47:34,Ride,7.319,2013-08-31 13:28:51+00:00,58.2,,160.2,2:52:54,,,,,,Ride
226583692,"09/03/2013 Midland, Michigan",40300.1,1:56:52,Ride,5.747,2013-09-03 21:32:04+00:00,14.6,,99.2,2:07:08,,,,,,Ride
226583686,"09/04/2013 Midland, Michigan",37012.3,1:22:43,Ride,7.458,2013-09-04 22:08:39+00:00,13.4,,144.6,1:24:21,,,,,,Ride
226583690,"09/08/2013 Midland, Michigan",55151.3,2:02:39,Ride,7.494,2013-09-08 20:37:40+00:00,22.7,,155.1,2:04:17,,,,,,Ride
226583688,"09/10/2013 Midland, Michigan",38514.3,1:24:51,Ride,7.565,2013-09-10 21:58:16+00:00,21.3,,162.2,1:59:37,,,,,,Ride
226583687,"09/22/2013 Midland, Michigan",55782.4,2:07:51,Ride,7.272,2013-09-22 15:50:08+00:00,23.0,,154.3,2:13:44,,,,,,Ride
226583677,"09/24/2013 Midland, Michigan",3563.0,0:07:14,Ride,8.21,2013-09-24 21:41:02+00:00,0.0,,143.8,0:10:18,,,,,,Ride
226583679,"09/28/2013 Midland, Michigan",55234.6,2:10:52,Ride,7.034,2013-09-28 18:07:39+00:00,23.4,,162.4,2:18:32,,,,,,Ride
226583680,"09/29/2013 Midland, Michigan",37086.6,1:27:19,Ride,7.079,2013-09-29 21:23:05+00:00,12.6,,145.7,1:28:34,,,,,,Ride
226583715,"10/02/2013 Midland, Michigan",40785.4,1:34:02,Ride,7.229,2013-10-02 21:28:37+00:00,23.3,,146.6,1:36:58,,,,,,Ride
226583709,"10/05/2013 Midland, Michigan",37342.0,1:28:01,Ride,7.071,2013-10-05 21:18:20+00:00,12.8,,150.9,1:28:56,,,,,,Ride
226583711,"10/08/2013 Midland, Michigan",44471.2,1:41:19,Ride,7.316,2013-10-08 21:06:00+00:00,23.6,,155.2,"1 day, 22:50:01",,,,,,Ride
226583707,"10/10/2013 Midland, Michigan",36893.0,1:22:00,Ride,7.499,2013-10-10 19:56:04+00:00,13.4,,156.4,1:25:54,,,,,,Ride
226583704,"10/15/2013 Midland, Michigan",40806.5,1:30:41,Ride,7.5,2013-10-15 20:58:54+00:00,12.6,,150.5,1:31:20,,,,,,Ride
226583705,"10/18/2013 Midland, Michigan",44609.7,1:42:46,Ride,7.235,2013-10-18 20:00:52+00:00,22.9,,140.0,1:53:20,,,,,,Ride
226583717,"10/23/2013 Midland, Michigan",32596.6,1:11:28,Ride,7.602,2013-10-23 17:22:36+00:00,0.0,,161.5,1:50:02,,,,,,Ride
226584516,"02/06/2014 Vila-seca, Catalunya, Spain",4707.3,0:42:37,Run,1.841,2014-02-06 17:01:31+00:00,0.0,,135.8,0:46:20,,,,,,Run
226584505,"03/30/2014 Midland, Michigan",30458.7,1:18:12,Ride,6.492,2014-03-30 22:36:10+00:00,12.6,,148.6,1:20:09,,,,,,Ride
226584557,"04/05/2014 Midland, Michigan",6501.7,0:16:13,Ride,6.682,2014-04-05 19:59:31+00:00,8.0,,160.6,0:17:00,82.1,,,84.4,,Ride
226584566,"04/05/2014 Midland, Michigan",30516.6,1:17:12,Ride,6.588,2014-04-05 20:16:31+00:00,12.8,,154.4,1:23:47,,,,,,Ride
226584513,"04/07/2014 Midland, Michigan",37515.4,1:37:33,Ride,6.41,2014-04-07 22:00:37+00:00,12.6,,136.5,3:14:51,,,,,,Ride
226584515,"04/12/2014 Midland, Michigan",54682.8,2:18:18,Ride,6.59,2014-04-12 13:33:56+00:00,23.5,,157.3,2:26:35,,,,,,Ride
226584506,"04/17/2014 Midland, Michigan",40970.7,1:36:30,Ride,7.076,2014-04-17 21:41:33+00:00,12.6,,154.3,1:39:35,,,,,,Ride
226584504,"04/20/2014 Midland, Michigan",93.5,0:00:47,Ride,1.989,2014-04-20 21:09:52+00:00,0.0,,97.6,0:02:50,,,,,,Ride
226584507,"04/20/2014 Midland, Michigan",49567.4,1:57:19,Ride,7.042,2014-04-20 21:12:52+00:00,23.2,,155.4,2:01:20,,,,,,Ride
226584510,"04/23/2014 Midland, Michigan",30109.8,1:11:34,Ride,7.012,2014-04-23 23:06:25+00:00,12.7,,148.6,1:14:15,,,,,,Ride
226584508,"04/24/2014 Midland, Michigan",54268.3,2:25:34,Ride,6.213,2014-04-24 21:26:26+00:00,23.6,,126.5,2:53:19,,,,,,Ride
226584520,"05/28/2014 Midland, Michigan",36645.7,1:27:32,Ride,6.977,2014-05-28 22:49:43+00:00,14.4,,150.8,1:28:16,,,,,,Ride
226584517,"05/29/2014 Midland, Michigan",63898.2,2:31:37,Ride,7.024,2014-05-29 21:28:14+00:00,34.1,,142.2,3:38:02,,,,,,Ride
226584539,"06/01/2014 Midland, Michigan",83522.9,3:39:40,Ride,6.337,2014-06-01 17:16:56+00:00,60.0,,155.5,"2 days, 5:31:16",,,,,,Ride
226584525,"06/03/2014 Midland, Michigan",32161.5,1:11:53,Ride,7.457,2014-06-03 22:55:08+00:00,16.0,,131.9,1:35:00,,,,,,Ride
226584533,"06/08/2014 Midland, Michigan",55801.3,2:19:22,Ride,6.673,2014-06-08 21:32:55+00:00,23.6,,152.5,2:22:00,,,,,,Ride
226584526,"06/09/2014 Midland, Michigan",17499.1,0:55:40,Ride,5.239,2014-06-09 23:15:13+00:00,0.0,,96.4,1:02:51,,,,,,Ride
226584524,"06/10/2014 Midland, Michigan",40669.1,1:34:01,Ride,7.21,2014-06-10 23:01:02+00:00,31.3,,148.7,1:42:25,,,,,,Ride
226584519,"06/14/2014 Midland, Michigan",36963.7,1:26:23,Ride,7.132,2014-06-14 22:13:12+00:00,13.1,,157.8,1:26:46,,,,,,Ride
226584521,"06/15/2014 Midland, Michigan",37388.2,1:26:41,Ride,7.189,2014-06-15 22:17:20+00:00,13.1,,155.3,1:27:46,,,,,,Ride
226584511,"06/16/2014 Midland, Michigan",27891.3,1:04:30,Ride,7.207,2014-06-16 23:08:12+00:00,12.5,,150.6,1:08:15,,,,,,Ride
226584509,"06/19/2014 Midland, Michigan",21043.1,0:44:09,Ride,7.944,2014-06-19 21:21:49+00:00,10.5,,163.0,0:44:09,,,,,,Ride
226584514,"06/20/2014 Midland, Michigan",44711.9,1:45:07,Ride,7.089,2014-06-20 21:54:24+00:00,23.4,,140.1,1:48:19,,,,,,Ride
226584534,"07/02/2014 Robbinsville, North Carolina",3368.8,0:38:50,Run,1.446,2014-07-02 15:48:23+00:00,0.0,,136.7,0:39:28,,,,,,Run
226584528,"07/02/2014 Lake Santeetlah, North Carolina",1796.6,0:20:20,Run,1.473,2014-07-02 21:01:56+00:00,0.0,,,0:22:44,,,,,,Run
226584529,"07/03/2014 Lake Santeetlah, North Carolina",3321.4,0:40:28,Run,1.368,2014-07-03 14:44:42+00:00,0.0,,103.2,0:41:51,,,,,,Run
226584565,"07/03/2014 Robbinsville, North Carolina",767.4,0:15:05,Ride,0.848,2014-07-03 17:37:02+00:00,47.3,,,6:18:10,,,,,,Ride
226584573,"07/03/2014 Lake Santeetlah, North Carolina",3505.9,0:41:46,Run,1.399,2014-07-03 23:55:12+00:00,45.6,,,18:56:13,,,,,,Run
226584568,"07/04/2014 Lake Santeetlah, North Carolina",34.6,0:00:47,Ride,0.736,2014-07-04 18:51:25+00:00,0.0,,82.1,0:05:56,,,,,,Ride
226584527,"07/04/2014 Robbinsville, North Carolina",8459.1,0:36:20,Ride,3.88,2014-07-04 19:05:26+00:00,120.3,,114.1,0:43:10,,,,,,Ride
226584537,"07/19/2014 Midland, Michigan",42157.9,1:43:03,Ride,6.818,2014-07-19 21:21:22+00:00,12.7,,163.1,1:46:59,,,,,,Ride
226584538,"07/21/2014 Midland, Michigan",54722.0,2:16:46,Ride,6.669,2014-07-21 22:44:09+00:00,27.7,,163.1,2:33:46,,,,,,Ride
226584532,"07/23/2014 Midland, Michigan",37375.6,1:26:53,Ride,7.17,2014-07-23 23:21:15+00:00,12.6,,154.9,1:31:18,,,,,,Ride
226584530,"07/30/2014 Midland, Michigan",40907.1,1:36:27,Ride,7.069,2014-07-30 21:32:11+00:00,12.6,,156.1,1:50:20,,,,,,Ride
226584531,"07/31/2014 Midland, Michigan",48552.5,1:59:18,Ride,6.783,2014-07-31 21:57:57+00:00,24.1,,159.1,2:21:16,,,,,,Ride
226584546,"08/18/2014 Midland, Michigan",42797.0,1:37:48,Ride,7.293,2014-08-18 22:53:18+00:00,22.9,,167.9,"1 day, 22:29:20",,,,,,Ride
226584543,"08/20/2014 Midland, Michigan",59000.1,2:20:59,Ride,6.975,2014-08-20 21:24:29+00:00,33.4,,151.5,2:52:49,,,,,,Ride
226584540,"08/22/2014 Midland, Michigan",48315.5,1:49:33,Ride,7.351,2014-08-22 22:25:48+00:00,23.0,,161.8,2:02:09,,,,,,Ride
226584547,"08/23/2014 Midland, Michigan",89400.6,3:40:55,Ride,6.745,2014-08-23 12:55:54+00:00,54.8,,152.8,4:52:02,,,,,,Ride
226584542,"08/26/2014 Midland, Michigan",50921.3,2:05:19,Ride,6.772,2014-08-26 21:33:04+00:00,22.8,,144.9,2:13:51,,,,,,Ride
226584523,"08/26/2014 Midland, Michigan",0.0,0:00:02,Ride,0.0,2014-08-27 02:25:48+00:00,0.0,,0.0,0:00:02,,,,,,Ride
226584541,"08/28/2014 Midland, Michigan",52777.9,1:53:24,Ride,7.757,2014-08-28 22:32:55+00:00,24.3,,153.9,1:54:16,,,,,,Ride
226584545,"08/29/2014 Midland, Michigan",56951.7,2:09:28,Ride,7.332,2014-08-29 21:51:50+00:00,23.5,,152.7,2:18:33,,,,,,Ride
226584555,"09/02/2014 Midland, Michigan",52832.5,1:56:04,Ride,7.587,2014-09-02 22:32:08+00:00,23.4,,142.5,1:56:44,,,,,,Ride
226584551,"09/04/2014 Midland, Michigan",36305.7,1:26:53,Ride,6.964,2014-09-04 21:32:08+00:00,13.5,,125.8,1:37:33,,,,,,Ride
226584562,"09/06/2014 Midland, Michigan",97361.9,3:52:28,Ride,6.98,2014-09-06 14:01:57+00:00,67.3,,157.4,4:11:14,,,,,,Ride
226584554,"09/07/2014 Midland, Michigan",68162.5,2:36:13,Ride,7.272,2014-09-07 11:36:53+00:00,24.0,,147.5,2:36:13,,,,,,Ride
226584553,"09/08/2014 Midland, Michigan",47697.2,2:10:21,Ride,6.099,2014-09-08 21:59:39+00:00,23.6,,135.3,2:55:27,,,,,,Ride
226584550,"09/11/2014 Midland, Michigan",44073.9,1:43:25,Ride,7.103,2014-09-11 22:34:27+00:00,23.7,,141.4,22:25:50,,,,,,Ride
226584574,"09/13/2014 Midland, Michigan",102098.0,4:02:06,Ride,7.029,2014-09-13 12:25:20+00:00,68.0,,150.0,4:15:34,,,,,,Ride
226584569,"09/14/2014 Midland, Michigan",119201.0,4:34:48,Ride,7.23,2014-09-14 12:22:11+00:00,84.0,,144.9,6:14:13,,,,,,Ride
226584548,"09/16/2014 Midland, Michigan",65139.1,2:23:00,Ride,7.592,2014-09-16 20:37:34+00:00,23.9,,140.6,2:27:25,,,,,,Ride
226584552,"09/18/2014 Midland, Michigan",64137.9,2:22:04,Ride,7.524,2014-09-18 21:04:51+00:00,23.7,,133.7,2:23:47,,,,,,Ride
226584544,"09/19/2014 Midland, Michigan",43589.0,1:33:16,Ride,7.789,2014-09-19 22:10:49+00:00,24.8,,139.7,1:33:43,,,,,,Ride
226584535,"09/20/2014 Midland, Michigan",40.6,0:00:10,Ride,4.06,2014-09-20 11:37:38+00:00,0.0,,99.0,0:00:10,,,,,,Ride
226584561,"09/20/2014 Midland, Michigan",128092.0,5:02:04,Ride,7.068,2014-09-20 11:38:02+00:00,84.4,,137.1,5:05:09,,,,,,Ride
226584577,"09/27/2014 Frankenmuth, Michigan",147046.0,5:14:50,Ride,7.784,2014-09-27 11:49:18+00:00,323.6,,147.7,7:02:52,,,,,,Ride
226584559,"09/28/2014 Frankenmuth, Michigan",152942.0,5:32:37,Ride,7.664,2014-09-28 11:40:05+00:00,110.1,,136.9,9:44:34,,,,,,Ride
226584564,"10/01/2014 Midland, Michigan",43549.6,1:38:28,Ride,7.371,2014-10-01 19:08:40+00:00,23.7,,120.9,1:43:55,,,,,,Ride
226584570,"10/03/2014 Midland, Michigan",37807.1,1:51:14,Ride,5.665,2014-10-03 20:21:29+00:00,0.0,,123.5,3:32:44,,,,,,Ride
226584572,"10/07/2014 Midland, Michigan",66077.1,2:20:22,Ride,7.846,2014-10-07 21:33:00+00:00,24.5,,140.8,2:23:02,,,,,,Ride
226584571,"10/10/2014 Midland, Michigan",82446.3,3:00:23,Ride,7.618,2014-10-10 18:45:43+00:00,35.1,,139.1,3:34:07,,,,,,Ride
226584560,"10/23/2014 Midland, Michigan",43225.0,1:30:11,Ride,7.988,2014-10-23 21:43:38+00:00,23.5,,157.5,1:33:29,,,,,,Ride
226584563,"10/25/2014 Midland, Michigan",69446.1,2:32:52,Ride,7.572,2014-10-25 16:10:23+00:00,23.5,,158.8,2:39:54,,,,,,Ride
226584567,"10/26/2014 Midland, Michigan",90143.1,3:20:45,Ride,7.484,2014-10-26 14:19:13+00:00,63.9,,146.7,3:40:54,,,,,,Ride
226584549,10/26/2014,0.0,0:00:03,Ride,0.0,2014-10-26 19:33:47+00:00,0.0,,79.0,0:00:03,,,,,,Ride
226583255,"11/01/2014 Midland, Michigan",82515.5,3:01:57,Ride,7.558,2014-11-01 18:45:37+00:00,33.8,,148.3,3:03:12,,,,,,Ride
226583252,"11/02/2014 Midland, Michigan",32284.7,1:03:44,Ride,8.443,2014-11-02 22:03:43+00:00,11.5,,150.5,1:04:16,,,,,,Ride
226583253,"11/09/2014 Midland, Michigan",73347.6,2:52:46,Ride,7.076,2014-11-09 15:27:39+00:00,34.0,,135.9,2:56:34,,,,,,Ride
227255937,"12/06/2014 Midland, Michigan",68283.0,2:34:08,Ride,7.384,2014-12-06 15:32:37+00:00,35.0,b1683032,140.5,"1 day, 5:18:38",2157.9,,,233.3,,Ride
229470201,"12/14/2014 Midland, Michigan",26092.9,1:01:27,Ride,7.077,2014-12-14 16:00:19+00:00,29.4,b1683032,140.3,4:57:55,810.8,,,219.9,,Ride
229470973,Adding missing data,16093.4,0:25:00,Ride,10.729,2014-12-14 18:00:00+00:00,0.0,b1683032,,0:25:00,,,,,,Ride
231248246,"12/20/2014 Midland, Michigan",54847.0,2:00:30,Ride,7.586,2014-12-20 20:07:45+00:00,23.7,b1683032,143.8,2:03:20,1768.1,,,244.6,,Ride
233174976,"12/26/2014 Midland, Michigan",66953.7,2:27:43,Ride,7.554,2014-12-26 16:32:26+00:00,22.7,b1683032,148.7,2:29:27,2153.3,,,243.0,,Ride
248846629,Hilly West Monroe,50749.9,1:55:26,Ride,7.327,2015-01-31 16:05:16+00:00,81.0,b1683032,154.8,2:06:41,1775.7,,,256.4,,Ride
248736255,"01/31/2015 Monroe, Louisiana",15272.7,0:32:12,Ride,7.905,2015-01-31 21:51:52+00:00,0.0,b1683032,166.7,0:46:35,515.1,,,266.6,,Ride
250149743,"02/03/2015 Monroe, Louisiana",23639.0,0:46:50,Ride,8.412,2015-02-03 23:22:10+00:00,0.0,b1683032,160.2,0:47:59,850.9,,,302.8,,Ride
270968079,"03/19/2015 Midland, Michigan",43436.9,1:34:03,Ride,7.697,2015-03-19 22:23:30+00:00,23.8,b1683032,141.1,1:35:25,1418.8,,,251.4,,Ride
271455785,Afternoon Ride,44594.9,1:41:49,Ride,7.3,2015-03-20 21:00:00+00:00,0.0,b1683032,,1:41:49,,,,,,Ride
272622252,Afternoon walk,2392.9,0:32:21,Walk,1.233,2015-03-22 21:48:41+00:00,0.0,,,0:32:46,,,,,,Walk
272849708,Morning Ride,6091.6,0:13:51,Ride,7.33,2015-03-23 12:57:23+00:00,10.8,b1683032,,0:17:15,207.9,,,250.2,,Ride
273080455,Afternoon Ride,5744.5,0:12:35,Ride,7.609,2015-03-23 21:08:22+00:00,10.8,b1683032,,0:13:33,196.9,,,260.8,,Ride
273634382,"03/24/2015 Midland, Michigan",43585.0,1:35:03,Ride,7.642,2015-03-24 21:58:05+00:00,21.7,b1683032,137.2,1:35:03,1433.3,,,251.3,,Ride
275899975,Midland to Sanford,53623.3,1:59:35,Ride,7.474,2015-03-29 13:50:00+00:00,0.0,b1683032,,1:59:35,,,,,,Ride
277713403,"04/01/2015 Midland, Michigan",62239.2,2:13:28,Ride,7.772,2015-04-01 21:57:38+00:00,23.1,b1683032,149.7,2:14:59,2045.2,,,255.4,,Ride
279257856,"04/04/2015 Midland, Michigan",77919.7,2:53:47,Ride,7.473,2015-04-04 15:58:34+00:00,34.5,b1683032,147.6,3:07:59,2488.1,,,238.6,,Ride
283366046,"04/11/2015 Midland, Michigan",60584.2,2:14:20,Ride,7.517,2015-04-11 14:15:25+00:00,37.6,b1683032,153.0,2:46:16,1992.2,,,247.2,,Ride
284164960,"04/12/2015 Midland, Michigan",103312.0,4:01:32,Ride,7.129,2015-04-12 13:50:04+00:00,62.0,b1683032,150.1,4:07:30,3158.5,,,217.9,,Ride
287361038,Da Ford Loop,43131.8,1:28:42,Ride,8.104,2015-04-17 20:42:21+00:00,23.9,b1683032,153.2,1:30:14,1458.6,,,274.1,,Ride
288616917,Exploration ride.  Easy 40,65183.4,2:27:54,Ride,7.345,2015-04-19 13:54:49+00:00,23.7,b1683032,140.7,2:34:40,2095.7,,,236.2,,Ride
291923739,"04/24/2015 Midland, Michigan",52743.2,1:50:22,Ride,7.965,2015-04-24 21:54:21+00:00,24.3,b1683032,158.6,1:51:25,1737.0,,,262.3,,Ride
292456776,"04/25/2015 Midland, Michigan",39038.2,1:16:51,Ride,8.466,2015-04-25 17:26:17+00:00,10.5,b1683032,153.8,2:41:27,1336.1,,,289.8,,Ride
292459215,Afternoon Ride,32186.9,1:15:00,Ride,7.153,2015-04-25 19:20:00+00:00,0.0,b1683032,,1:15:00,,,,,,Ride
294547393,"04/28/2015 Midland, Michigan",48292.0,1:43:58,Ride,7.742,2015-04-28 22:38:32+00:00,23.7,b1683032,139.1,1:44:20,1572.7,,,252.1,,Ride
304750927,Giant Demo days,14748.1,0:29:09,Ride,8.432,2015-05-04 20:08:45+00:00,0.0,b1683032,,0:30:58,514.1,,42.0,294.0,,Ride
304750925,Giant Demo Days,12750.3,0:25:58,Ride,8.184,2015-05-04 20:48:59+00:00,0.0,b1683032,,0:26:21,439.0,,,281.8,,Ride
304750930,"05/04/2015 Midland, Michigan",3532.7,0:12:29,Ride,4.717,2015-05-04 21:30:57+00:00,0.0,b1683032,,0:12:52,93.8,,,125.2,,Ride
304754690,Cutting Grass,1909.5,0:44:33,Walk,0.714,2015-05-13 21:34:49+00:00,0.0,,,0:57:10,,,,,,Walk
304757124,Evening Swim,3218.7,1:00:00,Swim,0.894,2015-05-14 00:40:00+00:00,0.0,,,1:00:00,,,,,,Swim
304751826,"05/14/2015 Midland, Michigan",11459.1,0:21:15,Ride,8.988,2015-05-14 21:37:43+00:00,0.0,b1683032,154.2,1:34:13,408.1,,,320.1,,Ride
304755564,Evening Ride,32186.9,1:09:00,Ride,7.775,2015-05-15 00:40:00+00:00,0.0,b1683032,,1:09:00,,,,,,Ride
305783889,"05/16/2015 Midland, Michigan",49861.4,1:46:41,Ride,7.79,2015-05-16 13:03:37+00:00,24.0,b1683032,151.2,1:46:56,1638.3,,,255.9,,Ride
306749126,"05/17/2015 Midland, Michigan",60636.0,2:10:03,Ride,7.771,2015-05-17 19:07:03+00:00,24.6,b1683032,153.7,2:11:59,1995.6,,,255.7,,Ride
309370519,Morning Ride to work,6254.0,0:14:24,Ride,7.238,2015-05-22 11:10:32+00:00,12.5,b1683032,,0:14:41,220.2,,,254.9,,Ride
309546750,Lunch Activity,6292.5,0:24:54,Workout,4.212,2015-05-22 16:48:42+00:00,10.7,,,0:29:41,,,,,,Workout
309722685,"05/22/2015 Midland, Michigan",48775.2,1:40:30,Ride,8.089,2015-05-22 22:26:18+00:00,24.3,b1683032,148.5,1:40:30,1634.9,,,271.1,,Ride
310968492,"05/24/2015 Midland, Michigan",101722.0,3:41:42,Ride,7.647,2015-05-24 12:51:33+00:00,66.9,b1683032,,3:45:01,3255.8,,,244.8,,Ride
311753028,"05/25/2015 Midland, Michigan",8258.7,0:17:34,Ride,7.836,2015-05-25 19:07:38+00:00,11.6,b1683032,132.0,0:17:34,274.9,,,260.8,,Ride
311927051,"05/25/2015 Midland, Michigan",40009.4,1:24:21,Ride,7.905,2015-05-25 22:23:40+00:00,13.2,b1683032,142.5,3:51:33,1332.5,,,263.3,,Ride
314438020,"05/29/2015 Midland, Michigan",66081.5,2:23:27,Ride,7.678,2015-05-29 19:39:08+00:00,23.9,b1683032,155.1,2:36:02,2150.5,,,249.9,,Ride
315026265,power cycles for 25,41650.1,1:31:59,Ride,7.547,2015-05-30 13:10:53+00:00,23.9,b1683032,133.5,1:34:10,1352.4,,,245.0,,Ride
315898284,"05/31/2015 Midland, Michigan",13336.5,0:39:10,Ride,5.675,2015-05-31 22:15:13+00:00,0.0,b1683032,117.9,0:53:35,424.9,,,180.8,,Ride
318534335,Poking around waiting for new tires,9027.5,0:21:00,Ride,7.165,2015-06-04 23:26:26+00:00,11.2,b1683032,137.9,0:26:15,289.5,,,229.8,,Ride
322888477,Evening Ride,49445.9,1:42:57,Ride,8.005,2015-06-10 22:15:12+00:00,32.9,b1683032,,1:44:32,1777.4,,,287.7,,Ride
326983456,"06/16/2015 Midland, Michigan",49304.1,1:42:20,Ride,8.03,2015-06-16 21:56:54+00:00,23.0,b1683032,157.7,1:43:11,1652.4,,,269.1,,Ride
328934687,"06/19/2015 Midland, Michigan",52768.9,1:44:51,Ride,8.388,2015-06-19 23:10:31+00:00,23.4,b1683032,151.0,1:45:22,1824.0,,,289.9,,Ride
329355217,"06/20/2015 Midland, Michigan",82195.6,2:56:51,Ride,7.746,2015-06-20 11:14:48+00:00,35.2,b1683032,146.1,2:57:50,2645.0,,,249.3,,Ride
330408269,"06/21/2015 Midland, Michigan",38499.3,1:49:10,Ride,5.878,2015-06-21 20:43:58+00:00,25.5,b1683032,98.8,2:01:13,1088.0,,,166.1,,Ride
331654503,"06/23/2015 Midland, Michigan",57128.6,2:01:24,Ride,7.843,2015-06-23 21:27:18+00:00,24.2,b1683032,139.6,2:03:04,1916.1,,,263.1,,Ride
333660099,"06/26/2015 Midland, Michigan",43221.3,1:32:39,Ride,7.775,2015-06-26 20:24:20+00:00,20.9,b1683032,143.7,2:57:58,1477.9,,,265.9,,Ride
334398932,"06/27/2015 Midland, Michigan",57633.2,2:02:49,Ride,7.821,2015-06-27 22:58:46+00:00,23.5,b1683032,128.9,2:03:11,1898.2,,,257.6,,Ride
335175209,Afternoon Ride,38334.6,1:39:45,Ride,6.405,2015-06-28 19:30:00+00:00,0.0,b1683032,,1:39:45,,,,,,Ride
340027446,"07/05/2015 Reston, Virginia",66094.0,2:30:37,Ride,7.314,2015-07-05 21:40:27+00:00,280.6,b1683032,155.6,2:37:59,2253.1,,,249.3,,Ride
341329649,"07/07/2015 Centreville, Virginia",23400.1,0:52:59,Ride,7.361,2015-07-07 23:13:37+00:00,146.7,b1683032,158.1,0:53:22,836.8,,,263.2,,Ride
342700431,"07/09/2015 Midland, Michigan",49272.5,1:43:19,Ride,7.948,2015-07-09 20:56:36+00:00,23.1,b1683032,148.7,1:44:23,1623.6,,,261.9,,Ride
343368176,"07/10/2015 Midland, Michigan",54958.1,1:55:24,Ride,7.937,2015-07-10 21:57:42+00:00,24.3,b1683032,158.7,1:58:05,1845.9,,,266.6,,Ride
344065939,"07/11/2015 Midland, Michigan",117153.0,4:20:16,Ride,7.502,2015-07-11 11:05:46+00:00,78.4,b1683032,145.1,4:43:15,3702.3,,,237.1,,Ride
344929167,"07/12/2015 Midland, Michigan",43640.3,1:35:44,Ride,7.598,2015-07-12 22:40:23+00:00,23.6,b1683032,140.4,1:36:12,1385.4,,,241.2,,Ride
347002930,"07/15/2015 Midland, Michigan",59648.2,2:03:16,Ride,8.065,2015-07-15 22:48:03+00:00,23.9,b1683032,145.3,2:07:59,2002.7,,,270.8,,Ride
350496067,"07/20/2015 Midland, Michigan",43662.6,1:32:48,Ride,7.842,2015-07-20 22:35:39+00:00,24.9,b1683032,161.1,1:40:30,1439.3,,,258.5,,Ride
351267146,"07/21/2015 Midland, Michigan",37687.7,1:31:55,Ride,6.834,2015-07-21 22:54:25+00:00,12.5,b1683032,152.7,1:33:44,1221.7,,,221.5,,Ride
353326404,"07/24/2015 Midland, Michigan",83982.1,3:00:18,Ride,7.763,2015-07-24 19:53:58+00:00,44.5,b1683032,158.7,3:01:32,2752.1,,,254.4,,Ride
354871002,"07/26/2015 Grayling, Michigan",161590.0,5:24:05,Ride,8.31,2015-07-26 12:28:19+00:00,451.4,b1683032,154.3,5:54:30,5533.4,,,284.6,,Ride
359132029,"08/01/2015 Midland, Michigan",62263.3,2:13:38,Ride,7.765,2015-08-01 13:20:36+00:00,23.6,b1683032,149.6,2:14:37,2026.8,,,252.8,,Ride
360694251,"08/03/2015 Midland, Michigan",46349.4,1:35:42,Ride,8.072,2015-08-03 22:45:54+00:00,22.5,b1683032,,1:36:48,1591.7,,,277.2,,Ride
362997318,"08/06/2015 Midland, Michigan",64852.0,2:15:31,Ride,7.976,2015-08-06 22:05:23+00:00,23.5,b1683032,156.5,2:15:53,2152.4,,,264.7,,Ride
364477355,"08/08/2015 Midland, Michigan",49239.5,1:45:04,Ride,7.811,2015-08-08 15:14:01+00:00,23.5,b1683032,151.4,1:50:48,1613.7,,,256.0,,Ride
366942261,Gym,0.0,1:00:00,Workout,0.0,2015-08-11 00:10:00+00:00,0.0,,,1:00:00,,,,,,Workout
366933138,"08/11/2015 Midland, Michigan",46480.0,1:39:44,Ride,7.767,2015-08-11 22:00:09+00:00,22.6,b1683032,143.5,1:39:44,1558.0,,,260.4,,Ride
369590382,"08/15/2015 Midland, Michigan",55718.9,2:00:43,Ride,7.693,2015-08-15 13:31:27+00:00,35.2,b1683032,152.2,2:01:26,1826.8,,,252.2,,Ride
370640686,"08/16/2015 Midland, Michigan",86813.7,3:12:26,Ride,7.519,2015-08-16 15:30:27+00:00,65.6,b1683032,155.6,3:48:05,2754.4,,,238.6,,Ride
373014878,Evening Ride,36138.8,1:16:53,Ride,7.834,2015-08-19 23:44:12+00:00,13.6,b1683032,,1:17:41,1209.4,,,262.2,,Ride
377498159,Evening Ride,50643.6,1:44:20,Ride,8.09,2015-08-25 22:28:50+00:00,47.2,b1683032,153.2,1:44:50,1715.7,,,274.1,,Ride
380309541,Morning Ride,82873.8,3:19:03,Ride,6.939,2015-08-29 14:40:16+00:00,78.8,b1683032,147.2,3:30:53,2759.1,,,231.0,,Ride
382150172,Evening Ride,41637.1,1:28:34,Ride,7.835,2015-08-31 22:52:46+00:00,23.5,b1683032,145.3,1:41:09,1393.5,,,262.2,,Ride
385000372,Evening Ride,43719.2,1:32:38,Ride,7.866,2015-09-04 22:01:57+00:00,24.0,b1683032,147.4,1:36:24,1442.2,,,259.5,,Ride
385713806,Morning Ride,110958.0,4:13:55,Ride,7.283,2015-09-05 13:45:22+00:00,113.3,b1683032,150.5,4:26:40,3554.1,,,233.3,,Ride
387380801,Afternoon Ride,35368.4,1:43:01,Ride,5.722,2015-09-07 21:16:36+00:00,13.3,b1683032,97.3,1:46:05,960.0,,,155.3,,Ride
390155881,Evening Swim,2286.0,1:00:00,Swim,0.635,2015-09-09 23:40:00+00:00,0.0,,,1:00:00,,,,,,Swim
390153413,Evening Ride,35683.9,1:17:00,Ride,7.724,2015-09-11 22:49:13+00:00,13.3,b1683032,130.3,1:18:12,1178.9,,,255.2,,Ride
390570000,Morning Ride,105860.0,3:56:35,Ride,7.458,2015-09-12 10:59:46+00:00,78.5,b1683032,141.6,4:06:56,3377.8,,,238.0,,Ride
391781206,Afternoon Ride,57759.4,2:09:03,Ride,7.46,2015-09-13 21:30:00+00:00,0.0,b1683032,,2:09:03,,,,,,Ride
393175354,Evening Ride,49430.9,1:43:07,Ride,7.989,2015-09-15 22:46:22+00:00,23.7,b1683032,142.7,1:44:51,1669.9,,,269.9,,Ride
395067619,Evening Ride,36230.6,1:16:26,Ride,7.9,2015-09-18 22:19:29+00:00,13.5,b1683032,120.0,1:21:41,1202.1,,,262.1,,Ride
399552308,Evening Swim,2286.0,1:00:00,Swim,0.635,2015-09-22 00:30:00+00:00,0.0,,,1:00:00,,,,,,Swim
399552599,Evening Swim,3017.5,1:00:00,Swim,0.838,2015-09-24 00:30:00+00:00,0.0,,,1:00:00,,,,,,Swim
399549878,Evening Ride,49408.8,1:44:20,Ride,7.893,2015-09-24 22:04:32+00:00,22.7,b1683032,147.9,1:45:55,1636.6,,,261.4,,Ride
400823807,Bike MS Ride Day 1,161757.0,5:47:07,Ride,7.767,2015-09-26 11:34:46+00:00,364.0,b1683032,143.5,6:58:15,5511.4,,,264.6,,Ride
401646887,Bike MS Day 200,161201.0,5:47:40,Ride,7.728,2015-09-27 11:26:52+00:00,120.1,b1683032,128.8,7:05:39,5177.2,,,248.2,,Ride
404458249,Evening Swim,2743.2,1:00:00,Swim,0.762,2015-09-29 00:30:00+00:00,0.0,,,1:00:00,,,,,,Swim
404446280,Afternoon Ride,34954.1,1:18:45,Ride,7.398,2015-10-01 21:53:57+00:00,13.7,b1683032,,1:22:19,1128.9,,,238.9,,Ride
410374062,Afternoon Ride,53939.3,1:54:49,Ride,7.83,2015-10-10 19:17:23+00:00,23.7,b1683032,131.9,1:55:21,1768.7,,,256.7,,Ride
411435121,Afternoon Ride,64648.6,2:22:32,Ride,7.559,2015-10-11 19:02:39+00:00,47.1,b1683032,147.1,2:31:31,2070.8,,,242.1,,Ride
433582437,Lunch Ride,59562.3,2:13:48,Ride,7.419,2015-11-14 17:17:28+00:00,52.3,b1683032,152.4,2:34:46,1915.8,,,238.6,,Ride
482956485,Lunch Ride,42816.7,1:32:08,Ride,7.745,2016-01-31 16:10:34+00:00,32.2,b1683032,,1:36:29,1468.6,,,265.7,,Ride
498255539,Afternoon Ride,36312.7,1:20:06,Ride,7.556,2016-02-20 21:54:03+00:00,17.9,b1683032,143.9,1:28:10,1167.9,,,243.0,,Ride
516159804,Lunch Ride,49788.0,1:50:52,Ride,7.485,2016-03-13 15:11:09+00:00,32.4,b1683032,,1:52:33,1852.4,,,278.5,,Ride
522453694,Afternoon Ride,53392.8,1:53:48,Ride,7.82,2016-03-20 18:37:22+00:00,30.1,b1683032,,1:55:57,1722.3,,,252.2,,Ride
526793894,Afternoon Ride,25375.8,0:53:27,Ride,7.913,2016-03-25 21:56:28+00:00,0.0,b1683032,,0:58:06,848.7,,,264.7,,Ride
530355328,Riding kind of naked in Lafitte,31563.4,1:06:51,Ride,7.869,2016-03-29 22:38:31+00:00,0.0,b1683032,,1:07:06,1018.7,,,254.0,,Ride
532976674,Evening Ride,35957.1,1:19:13,Ride,7.565,2016-04-01 22:48:02+00:00,18.0,b1683032,,1:26:11,1145.0,,,240.9,,Ride
548637761,Morning Ride,65982.9,2:29:59,Ride,7.332,2016-04-17 11:53:24+00:00,36.5,b1683032,122.8,2:29:59,2028.2,,,225.4,,Ride
556032203,Morning Ride,36086.7,1:19:23,Ride,7.576,2016-04-24 13:21:58+00:00,17.5,b1683032,,1:19:47,1168.0,,,245.2,,Ride
557841966,Evening Ride,44370.5,1:36:26,Ride,7.669,2016-04-26 22:24:44+00:00,28.9,b1683032,133.6,1:37:11,1429.6,,,247.1,,Ride
564630280,Evening Swim,2743.2,1:00:00,Swim,0.762,2016-05-03 00:30:00+00:00,0.0,,,1:00:00,,,,,,Swim
564628092,Evening Ride,44872.6,1:37:35,Ride,7.664,2016-05-03 22:13:52+00:00,29.0,b1683032,147.0,1:38:41,1423.8,,,243.2,,Ride
567702437,Afternoon Ride,65210.4,2:25:14,Ride,7.483,2016-05-06 19:35:53+00:00,41.3,b1683032,148.6,2:27:13,2099.2,,,240.9,,Ride
573210489,Afternoon Ride,66485.4,2:27:09,Ride,7.53,2016-05-11 21:21:14+00:00,36.1,b1683032,131.1,3:05:45,2143.4,,,242.8,,Ride
581698862,Evening Ride,48380.6,1:44:23,Ride,7.725,2016-05-19 23:07:59+00:00,32.2,b1683032,141.7,1:44:23,1563.3,,,249.6,,Ride
583707550,Lunch Ride,77340.8,2:51:31,Ride,7.515,2016-05-21 16:12:10+00:00,34.8,b1683032,157.2,2:53:09,2430.9,,,236.2,,Ride
587098114,Afternoon Ride,66015.9,2:24:51,Ride,7.596,2016-05-24 21:55:06+00:00,35.7,b1683032,157.6,2:26:19,2085.2,,,239.9,,Ride
590159760,Night Run,0.0,0:03:07,Run,0.0,2016-05-26 01:20:17+00:00,0.0,g1453101,122.8,0:03:07,,,,,,Run
588201274,Night Run,3670.8,0:26:08,Run,2.341,2016-05-26 01:26:00+00:00,0.0,,147.7,0:26:42,,,,,,Run
590159836,Afternoon Ride,54683.4,1:57:24,Ride,7.763,2016-05-27 21:05:24+00:00,30.2,b1683032,138.3,1:58:06,1761.8,,,250.1,,Ride
591348406,Evening Ride,43786.0,1:34:46,Ride,7.701,2016-05-28 23:05:33+00:00,28.6,b1683032,,1:39:11,1413.7,,,248.6,,Ride
593588931,Afternoon Ride,74290.7,2:48:11,Ride,7.362,2016-05-30 20:31:19+00:00,68.0,b1683032,154.6,2:52:28,2338.0,,,231.7,,Ride
596757242,Night run forest fest,5149.9,0:48:00,Run,1.788,2016-06-02 22:15:43+00:00,0.0,g1453101,,0:48:00,,,,,,Run
598622444,Afternoon Ride,50764.9,1:53:05,Ride,7.482,2016-06-04 18:02:04+00:00,29.4,b1683032,136.3,2:18:21,1602.0,,,236.1,,Ride
604434653,Evening Swim,2743.2,1:10:00,Swim,0.653,2016-06-09 00:50:00+00:00,0.0,,,1:10:00,,,,,,Swim
604428396,Evening Ride,41702.7,1:27:09,Ride,7.975,2016-06-09 22:29:45+00:00,28.4,b1683032,144.7,1:32:30,1357.8,,,259.7,,Ride
608613128,Evening Ride,23132.8,0:53:29,Ride,7.209,2016-06-13 23:39:03+00:00,18.5,b1683032,134.9,1:37:58,736.4,,,229.5,,Ride
613368881,Michigan Mountain Mayhem,112206.0,4:48:53,Ride,6.474,2016-06-18 11:14:33+00:00,1125.0,b1683032,139.4,5:29:28,4080.6,,,235.4,,Ride
615692974,Evening Swim,1600.0,1:00:00,Swim,0.444,2016-06-20 23:00:00+00:00,0.0,,,1:00:00,,,,,,Swim
616427436,Lunch Swim,2400.0,1:00:00,Swim,0.667,2016-06-21 15:30:00+00:00,0.0,,,1:00:00,,,,,,Swim
616723555,Evening Ride,41652.1,1:29:45,Ride,7.735,2016-06-21 22:44:19+00:00,28.6,b1683032,141.1,1:29:45,1318.5,,,244.8,,Ride
618305454,Evening Swim,2000.0,0:45:00,Swim,0.741,2016-06-22 23:00:00+00:00,0.0,,,0:45:00,,,,,,Swim
618756794,Lunch swim,2200.0,1:00:00,Swim,0.611,2016-06-23 20:50:10+00:00,0.0,,,1:00:00,,,,,,Swim
618853179,Evening Ride,45189.1,1:35:46,Ride,7.864,2016-06-23 22:28:04+00:00,28.5,b1683032,150.8,1:37:20,1450.5,,,252.4,,Ride
619585581,Lunch Swim,2600.0,1:00:00,Swim,0.722,2016-06-24 15:30:00+00:00,0.0,,,1:00:00,,,,,,Swim
621676359,Morning Ride,83909.2,3:03:08,Ride,7.636,2016-06-26 12:40:24+00:00,63.9,b1683032,143.9,3:07:31,2580.6,,,234.9,,Ride
623464441,Lunch Swim,2600.0,1:00:00,Swim,0.722,2016-06-27 15:30:00+00:00,0.0,,,1:00:00,,,,,,Swim
624732356,Lunch Swim,2600.0,1:00:00,Swim,0.722,2016-06-28 16:20:00+00:00,0.0,,,1:00:00,,,,,,Swim
624733105,Lunch Swim,2000.0,0:45:00,Swim,0.741,2016-06-29 15:30:00+00:00,0.0,,,0:45:00,,,,,,Swim
625148551,Afternoon Ride,58499.7,2:02:25,Ride,7.965,2016-06-29 21:30:00+00:00,0.0,b1683032,,2:02:25,,,,,,Ride
627086872,Night Swim,1600.0,0:50:00,Swim,0.533,2016-07-01 03:16:34+00:00,0.0,,,0:50:00,,,,,,Swim
627869642,Afternoon Swim,2500.0,1:00:04,Swim,0.694,2016-07-02 15:45:34+00:00,0.0,,,1:00:04,,,,,,Swim
628034900,Afternoon Walk,4964.8,1:01:38,Walk,1.343,2016-07-02 21:33:25+00:00,0.0,g1453101,,1:04:57,,,,,,Walk
631590612,Lunch Swim,2500.0,1:00:00,Swim,0.694,2016-07-04 15:00:00+00:00,0.0,,,1:00:00,,,,,,Swim
631590424,Lunch Swim,2000.0,1:00:00,Swim,0.556,2016-07-05 15:30:00+00:00,0.0,,,1:00:00,,,,,,Swim
631586684,Afternoon Ride,54900.6,1:58:59,Ride,7.69,2016-07-05 21:32:47+00:00,31.4,b1683032,142.1,2:17:49,1743.0,,,244.2,,Ride
634573239,Afternoon Ride,49195.6,1:41:35,Ride,8.071,2016-07-08 21:48:00+00:00,32.2,b1683032,,1:43:55,1683.1,,,276.1,,Ride
636627300,Lunch Swim,2300.0,1:00:00,Swim,0.639,2016-07-09 16:10:00+00:00,0.0,,,1:00:00,,,,,,Swim
636621109,Lunch Swim,2800.0,1:00:00,Swim,0.778,2016-07-10 16:00:00+00:00,0.0,,,1:00:00,,,,,,Swim
639157059,Lunch swim,3000.0,1:00:00,Swim,0.833,2016-07-11 15:45:35+00:00,0.0,,,1:00:00,,,,,,Swim
640195344,Evening Ride,64437.5,2:20:14,Ride,7.658,2016-07-13 22:21:22+00:00,41.7,b1683032,146.5,2:20:14,2040.7,,,242.5,,Ride
643332074,Night Swim,2000.0,1:00:00,Swim,0.556,2016-07-15 15:45:07+00:00,0.0,,,1:00:00,,,,,,Swim
643333276,Night Swim,2300.0,1:00:00,Swim,0.639,2016-07-16 15:45:08+00:00,0.0,,,1:00:00,,,,,,Swim
644206621,Afternoon Swim,2200.0,1:00:00,Swim,0.611,2016-07-17 16:13:05+00:00,0.0,,,1:00:00,,,,,,Swim
644672887,Evening Ride,41675.5,1:26:32,Ride,8.027,2016-07-17 23:02:27+00:00,27.7,b1683032,140.4,1:26:32,1353.1,,,260.6,,Ride
645750673,Swim,2400.0,1:00:00,Swim,0.667,2016-07-18 15:36:10+00:00,0.0,,,1:00:00,,,,,,Swim
646419345,Lunch Swim,1800.0,1:00:00,Swim,0.5,2016-07-19 16:50:00+00:00,0.0,,,1:00:00,,,,,,Swim
646973191,Evening Ride,70373.9,2:42:14,Ride,7.23,2016-07-19 22:15:32+00:00,46.3,b1683032,136.7,2:43:34,2234.4,,,229.5,,Ride
648931802,Lunch Swim,2000.0,1:00:00,Swim,0.556,2016-07-20 15:30:00+00:00,0.0,,,1:00:00,,,,,,Swim
648930863,Lunch Swim,2100.0,0:45:00,Swim,0.778,2016-07-21 15:00:00+00:00,0.0,,,0:45:00,,,,,,Swim
649815801,Lunch Swim,2700.0,1:00:00,Swim,0.75,2016-07-22 15:30:00+00:00,0.0,,,1:00:00,,,,,,Swim
657869632,Afternoon Run,4249.7,0:33:24,Run,2.121,2016-07-29 22:01:28+00:00,0.0,g1453101,149.3,0:36:15,,,,,,Run
661448715,Afternoon Run,4220.8,0:31:12,Run,2.255,2016-08-01 22:43:31+00:00,0.0,g1453101,151.6,0:33:31,,,,,,Run
684469273,Evening Ride,43735.6,1:34:41,Ride,7.699,2016-08-21 22:14:41+00:00,28.9,b1683032,155.1,1:34:56,1383.0,,,243.4,,Ride
685382576,Lunch Swim,2200.0,0:45:00,Swim,0.815,2016-08-22 15:30:00+00:00,0.0,,,0:45:00,,,,,,Swim
685596270,Evening Ride,37510.9,1:23:13,Ride,7.513,2016-08-22 22:26:13+00:00,17.6,b1683032,157.4,1:48:56,1147.0,,,229.7,,Ride
686376450,Lunch Swim,2000.0,0:43:00,Swim,0.775,2016-08-23 15:30:00+00:00,0.0,,,0:43:00,,,,,,Swim
686799518,Afternoon Ride,48737.4,1:50:57,Ride,7.321,2016-08-23 21:31:09+00:00,28.2,b1683032,152.9,1:55:44,1463.0,,,219.8,,Ride
687629822,Afternoon Swim,2300.0,0:45:00,Swim,0.852,2016-08-24 17:20:00+00:00,0.0,,,0:45:00,,,,,,Swim
689162406,Afternoon Ride,64433.7,2:31:40,Ride,7.081,2016-08-25 21:10:00+00:00,47.2,b1683032,122.0,3:18:30,1916.3,,,210.6,,Ride
692328407,Afternoon Swim,2200.0,0:44:00,Swim,0.833,2016-08-26 15:40:04+00:00,0.0,,,0:44:00,,,,,,Swim
691429842,Evening Ride,47758.5,1:42:47,Ride,7.744,2016-08-27 22:10:33+00:00,29.5,b1683032,137.0,1:49:36,1536.8,,,249.2,,Ride
692323238,Afternoon Swim,1800.0,1:00:00,Swim,0.5,2016-08-28 15:45:14+00:00,0.0,,,1:00:00,,,,,,Swim
693794250,Evening Ride,55944.1,2:03:38,Ride,7.542,2016-08-29 22:03:21+00:00,35.8,b1683032,143.8,2:04:29,1744.5,,,235.2,,Ride
697371178,Evening Ride,43711.9,1:31:05,Ride,7.999,2016-09-01 22:24:31+00:00,28.3,b1683032,144.1,1:31:41,1411.3,,,258.3,,Ride
701974508,Afternoon Ride,53145.2,2:05:53,Ride,7.036,2016-09-03 18:43:48+00:00,272.3,b1683032,128.0,2:15:38,1700.1,,,225.1,,Ride
703123999,Afternoon Ride,8210.3,0:18:46,Ride,7.292,2016-09-06 21:52:56+00:00,0.0,b1683032,137.1,0:20:04,243.7,,,216.4,,Ride
703124059,Evening Ride,35221.6,1:13:56,Ride,7.94,2016-09-06 22:13:06+00:00,17.8,b1683032,159.4,1:14:18,1155.9,,,260.6,,Ride
705038626,Lunch Swim,3218.7,1:00:00,Swim,0.894,2016-09-08 00:30:38+00:00,0.0,,,1:00:00,,,,,,Swim
707519201,Morning Ride,45736.2,1:37:51,Ride,7.79,2016-09-10 13:56:14+00:00,31.1,b1683032,147.4,1:43:58,1451.0,,,247.1,,Ride
709163289,Afternoon Ride,75754.2,2:45:29,Ride,7.63,2016-09-11 18:18:58+00:00,67.0,b1683032,157.5,2:46:15,2372.9,,,239.0,,Ride
713767506,Evening Swim,2743.2,1:00:00,Swim,0.762,2016-09-13 00:30:00+00:00,0.0,,,1:00:00,,,,,,Swim
713735463,Afternoon Ride,60214.6,2:03:12,Ride,8.146,2016-09-15 21:00:37+00:00,36.1,b1683032,,2:36:33,1996.6,,,270.1,,Ride
717284795,Lunch Ride,2960.0,0:07:51,Ride,6.285,2016-09-18 16:31:21+00:00,0.0,b1683032,87.0,0:07:51,83.6,,,177.4,,Ride
717284851,Afternoon Ride,95972.2,3:31:32,Ride,7.562,2016-09-18 18:02:38+00:00,64.7,b1683032,146.2,3:36:55,2954.4,,,232.8,,Ride
718386490,Night Swim,2735.9,1:00:00,Swim,0.76,2016-09-20 00:30:27+00:00,0.0,,,1:00:00,,,,,,Swim
723648666,Morning Ride,162190.0,5:37:04,Ride,8.02,2016-09-24 12:02:21+00:00,324.9,b1683032,124.0,6:50:52,5434.7,,,268.7,,Ride
725010826,Morning Ride,123134.0,4:17:24,Ride,7.973,2016-09-25 11:37:53+00:00,84.2,b1683032,125.3,5:44:01,3939.2,,,255.1,,Ride
732689867,Afternoon Ride,36758.4,1:22:00,Ride,7.471,2016-10-02 21:15:28+00:00,16.6,b1683032,,1:22:17,1153.5,,,234.5,,Ride
745873887,Afternoon Ride,43139.2,1:32:47,Ride,7.749,2016-10-15 20:52:10+00:00,28.9,b1683032,,1:46:48,1345.4,,,241.7,,Ride
752464800,Lunch Swim,3862.4,1:45:00,Swim,0.613,2016-10-22 13:23:57+00:00,0.0,,,1:45:00,,,,,,Swim
784792602,Afternoon Ride,21980.6,0:48:39,Ride,7.53,2016-11-24 21:29:13+00:00,0.0,b1683032,,0:48:39,687.9,,,235.7,,Ride
785467057,Afternoon Ride,44742.0,1:36:16,Ride,7.746,2016-11-25 20:05:48+00:00,0.0,b1683032,,1:42:11,1421.5,,,246.1,,Ride
793906439,Afternoon Ride,25553.3,0:56:06,Ride,7.592,2016-12-04 19:34:07+00:00,29.6,b1683032,,2:20:08,801.9,,,238.2,,Ride
793909468,Evening Ride,24140.2,1:00:00,Ride,6.706,2016-12-05 00:00:00+00:00,0.0,b1683032,,1:00:00,,,,,,Ride
871497734,Afternoon Ride,43440.9,1:35:11,Ride,7.607,2017-02-18 20:09:05+00:00,29.3,b1683032,154.8,1:36:21,1353.4,,,237.0,,Ride
872970504,Afternoon Ride,27718.1,1:00:56,Ride,7.582,2017-02-19 21:29:55+00:00,17.5,b1683032,,1:02:19,845.1,,,231.1,,Ride
906917668,Afternoon Ride,48780.5,1:47:54,Ride,7.535,2017-03-19 19:30:37+00:00,35.0,b1683032,154.2,1:55:22,1510.4,,,233.3,,Ride
935419796,Lunch Ride,32680.1,1:23:54,Ride,6.492,2017-04-09 16:34:04+00:00,32.9,b1683032,129.7,2:01:49,900.0,,,178.8,,Ride
943888488,Afternoon walk,2990.6,0:41:56,Run,1.189,2017-04-15 20:54:14+00:00,0.0,g1453101,,0:42:27,,,,,,Run
958240406,Evening Ride,27689.4,1:10:48,Ride,6.518,2017-04-25 22:10:18+00:00,17.4,b1683032,104.8,1:15:28,779.6,,,183.5,,Ride
975220393,Afternoon Ride,54441.1,2:01:41,Ride,7.457,2017-05-06 18:08:42+00:00,27.8,b1683032,148.9,2:12:08,1648.2,,,225.7,,Ride
979036580,Evening Ride,41641.2,1:28:09,Ride,7.873,2017-05-09 22:34:36+00:00,35.0,b1683032,148.9,1:28:52,1329.0,,,251.3,,Ride
980652862,Afternoon Ride,52566.6,1:44:59,Ride,8.345,2017-05-10 21:40:44+00:00,26.6,b1683032,142.3,1:54:16,1827.7,,,290.2,,Ride
984998742,Afternoon Ride,59201.3,2:08:23,Ride,7.685,2017-05-13 21:31:38+00:00,42.8,b1683032,155.7,2:09:23,1896.4,,,246.2,,Ride
988389030,Evening Swim,2560.3,1:00:00,Swim,0.711,2017-05-16 00:30:00+00:00,0.0,,,1:00:00,,,,,,Swim
994929682,Evening Ride,43788.7,1:35:43,Ride,7.625,2017-05-18 22:12:25+00:00,37.8,b1683032,147.7,1:43:43,1372.1,,,238.9,,Ride
997611286,Evening Swim,3701.5,1:40:00,Swim,0.617,2017-05-20 13:08:25+00:00,0.0,,,1:40:00,,,,,,Swim
999714415,Evening Ride,8201.0,0:19:31,Ride,7.003,2017-05-21 23:00:17+00:00,0.0,b1683032,136.7,0:19:48,224.6,,,191.8,,Ride
999714439,Evening Ride,34546.2,1:17:31,Ride,7.428,2017-05-21 23:21:52+00:00,28.6,b1683032,144.3,1:17:31,1077.2,,,231.6,,Ride
1004210139,Afternoon Ride,34236.9,1:20:26,Ride,7.094,2017-05-24 21:41:01+00:00,18.1,b1683032,,1:23:45,1016.3,,,210.6,,Ride
1007123733,Afternoon Ride,52606.7,1:53:51,Ride,7.701,2017-05-26 20:29:06+00:00,101.2,b1683032,141.1,1:58:22,1688.5,,,247.2,,Ride
1008208714,Morning Ride,88103.4,3:04:41,Ride,7.951,2017-05-27 11:59:36+00:00,157.2,b1683032,,3:42:59,2894.6,,,261.2,,Ride
1011646308,Lunch Ride,55022.0,2:07:07,Ride,7.214,2017-05-29 15:44:51+00:00,106.8,b1683032,147.0,2:08:56,1672.1,,,219.2,,Ride
1018982633,Morning Ride,43747.1,1:33:02,Ride,7.837,2017-06-03 11:46:43+00:00,79.0,b1683032,151.6,1:34:57,1375.9,,,246.5,,Ride
1021403043,Afternoon Ride,28526.5,1:03:46,Ride,7.456,2017-06-04 18:06:13+00:00,35.9,b1683032,156.7,1:04:06,878.1,,,229.5,,Ride
1023126741,Evening Run,3661.1,0:26:33,Run,2.298,2017-06-05 22:38:14+00:00,8.4,g1453101,144.5,0:27:04,,,,,,Run
1024503765,Afternoon Ride,54693.5,1:58:42,Ride,7.68,2017-06-06 21:58:28+00:00,106.7,b1683032,145.2,1:59:52,1771.5,,,248.7,,Ride
1026034446,Evening Run,4266.5,0:33:11,Run,2.143,2017-06-07 22:46:28+00:00,8.5,g1453101,142.5,0:33:25,,,,,,Run
1027640738,Evening Ride,58581.9,2:02:42,Ride,7.957,2017-06-08 23:05:38+00:00,118.0,b1683032,149.1,2:05:26,1908.2,,,259.2,,Ride
1030613642,Evening Ride,28643.6,1:03:37,Ride,7.504,2017-06-11 00:28:16+00:00,33.7,b1683032,135.7,1:03:37,907.2,,,237.7,,Ride
1033772282,Evening Ride,9181.9,0:22:48,Ride,6.712,2017-06-12 22:10:09+00:00,15.3,b1683032,,0:24:12,267.4,,,195.4,,Ride
1033907562,Evening Ride,9113.1,0:23:26,Ride,6.482,2017-06-13 00:56:00+00:00,24.4,b1683032,,0:24:25,287.3,,,204.3,,Ride
1035542273,Evening Ride,33577.2,1:14:01,Ride,7.561,2017-06-14 00:01:28+00:00,66.7,b1683032,140.7,1:19:11,1111.9,,,250.4,,Ride
1037042944,Afternoon Ride,38194.5,1:26:44,Ride,7.339,2017-06-14 21:49:07+00:00,102.8,b1683032,,1:37:57,1232.9,,,236.9,,Ride
1040064795,Evening Ride,27712.2,0:57:10,Ride,8.079,2017-06-17 00:05:41+00:00,49.4,b1683032,150.0,1:11:21,915.7,,,267.0,,Ride
1041727778,Evening Run,4360.9,0:30:52,Run,2.355,2017-06-18 00:03:51+00:00,8.1,g1453101,162.5,0:32:27,,,,,,Run
1044391591,Lunch Swim - first one,2000.0,1:00:00,Swim,0.556,2017-06-19 16:10:00+00:00,0.0,,,1:00:00,,,,,,Swim
1045937890,Lunch Swim,2500.0,1:00:00,Swim,0.694,2017-06-20 16:10:00+00:00,0.0,,,1:00:00,,,,,,Swim
1047576793,Lunch Swim,3000.0,1:00:00,Swim,0.833,2017-06-21 16:30:00+00:00,0.0,,,1:00:00,,,,,,Swim
1048145707,Afternoon Ride,27927.6,1:04:19,Ride,7.237,2017-06-21 21:49:35+00:00,55.7,b1683032,110.2,1:05:16,853.2,,,221.1,,Ride
1049238878,Afternoon Swim,2650.0,1:00:00,Swim,0.736,2017-06-22 17:30:00+00:00,0.0,,,1:00:00,,,,,,Swim
1049573973,Cutting graas,1792.1,0:34:29,Walk,0.866,2017-06-22 21:46:03+00:00,0.0,g1453101,,0:44:35,,,,,,Walk
1050624072,Afternoon Swim,2900.0,1:00:00,Swim,0.806,2017-06-23 17:20:00+00:00,0.0,,,1:00:00,,,,,,Swim
1054421416,Evening Ride,45531.9,1:38:55,Ride,7.672,2017-06-25 23:18:40+00:00,94.3,b1683032,129.4,2:09:26,1473.2,,,248.2,,Ride
1055386138,Afternoon Swim,2600.0,1:00:00,Swim,0.722,2017-06-26 17:20:00+00:00,0.0,,,1:00:00,,,,,,Swim
1056856482,Lunch Swim,2300.0,0:45:00,Swim,0.852,2017-06-27 16:40:00+00:00,0.0,,,0:45:00,,,,,,Swim
1057395995,Afternoon Ride,55009.6,1:59:54,Ride,7.647,2017-06-27 21:52:23+00:00,78.6,b1683032,140.2,2:01:51,1717.4,,,238.7,,Ride
1058330385,Lunch Swim,2300.0,1:00:00,Swim,0.639,2017-06-28 16:10:00+00:00,0.0,,,1:00:00,,,,,,Swim
1063043960,Afternoon Ride,70998.3,2:31:59,Ride,7.786,2017-07-01 20:02:50+00:00,129.3,b1683032,155.2,2:35:13,2250.6,,,246.8,,Ride
1064410358,Afternoon Swim,2500.0,0:50:00,Swim,0.833,2017-07-02 16:22:08+00:00,0.0,,,0:50:00,,,,,,Swim
1065764225,Lunch Swim,1500.0,0:30:00,Swim,0.833,2017-07-03 16:00:00+00:00,0.0,,,0:30:00,,,,,,Swim
1067209665,Morning Ride,60243.4,2:05:21,Ride,8.01,2017-07-04 12:56:49+00:00,59.2,b1683032,137.4,2:31:02,1894.8,,,251.9,,Ride
1069108085,Lunch Swim,2000.0,0:45:00,Swim,0.741,2017-07-05 16:50:00+00:00,0.0,,,0:45:00,,,,,,Swim
1069661478,Afternoon Ride,47259.3,1:55:12,Ride,6.837,2017-07-05 21:13:54+00:00,86.8,b1683032,112.7,2:20:25,1379.0,,,199.5,,Ride
1070850503,Afternoon Swim,2400.0,1:00:00,Swim,0.667,2017-07-06 17:50:00+00:00,0.0,,,1:00:00,,,,,,Swim
1071269708,Evening Run,2414.0,0:18:00,Run,2.235,2017-07-07 00:14:58+00:00,0.0,g1453101,,0:18:00,,,,,,Run
1072174690,Lunch Swim,3000.0,1:00:00,Swim,0.833,2017-07-07 16:20:00+00:00,0.0,,,1:00:00,,,,,,Swim
1072552761,Afternoon Ride,65260.6,2:25:49,Ride,7.459,2017-07-07 20:59:23+00:00,116.3,b1683032,135.6,2:26:12,2008.8,,,229.6,,Ride
1073709192,Morning Ride,87552.8,3:00:20,Ride,8.092,2017-07-08 12:03:50+00:00,127.6,b1683032,,3:31:04,2856.3,,,264.0,,Ride
1077028911,Lunch Swim,2100.0,0:45:00,Swim,0.778,2017-07-10 16:10:00+00:00,0.0,,,0:45:00,,,,,,Swim
1077562374,Evening Run,4628.4,0:37:23,Run,2.063,2017-07-10 22:42:15+00:00,10.6,g1453101,135.2,0:38:07,,,,,,Run
1078601695,Lunch Swim,2800.0,0:56:00,Swim,0.833,2017-07-11 16:50:00+00:00,0.0,,,0:56:00,,,,,,Swim
1084980405,forgot to switch computer to ride,43595.7,1:48:51,Ride,6.675,2017-07-15 11:39:21+00:00,137.8,b1683032,116.6,1:54:15,684.3,,,104.8,,Ride
1084980466,Morning Ride,78677.8,3:38:15,Ride,6.008,2017-07-15 13:33:38+00:00,250.6,b1683032,106.9,4:44:25,1982.1,,,151.4,,Ride
1086872670,Morning Ride,80522.4,3:39:32,Ride,6.113,2017-07-16 11:34:36+00:00,255.2,b1683032,106.8,4:20:25,2160.1,,,164.0,,Ride
1088718366,Evening Run,5314.4,0:38:52,Run,2.279,2017-07-17 22:36:10+00:00,11.2,g1453101,147.2,0:41:12,,,,,,Run
1092134761,Evening Run,3977.3,0:28:40,Run,2.312,2017-07-19 22:46:27+00:00,5.5,g1453101,151.3,0:49:00,,,,,,Run
1095959602,Morning Ride,36025.6,1:17:25,Ride,7.756,2017-07-22 12:37:16+00:00,60.5,b1683032,133.7,1:21:49,1133.9,,,244.1,,Ride
1099493507,Lunch Swim,2700.0,1:00:00,Swim,0.75,2017-07-24 16:30:00+00:00,0.0,,,1:00:00,,,,,,Swim
1100011284,Evening Run,5058.2,0:34:10,Run,2.467,2017-07-24 22:33:10+00:00,11.7,g1453101,151.1,1:51:09,,,,,,Run
1101457321,Afternoon Swim,2500.0,1:00:00,Swim,0.694,2017-07-25 16:04:03+00:00,0.0,,,1:00:00,,,,,,Swim
1101716012,Evening Ride,36315.1,1:17:48,Ride,7.78,2017-07-25 23:22:22+00:00,63.3,b1683032,142.4,1:19:15,1157.2,,,247.9,,Ride
1104895924,Evening Ride,21887.8,0:43:45,Ride,8.338,2017-07-27 23:15:58+00:00,56.3,b1683032,153.6,0:47:56,748.0,,,284.9,,Ride
1104895981,Evening Run,2268.6,0:19:16,Run,1.962,2017-07-28 00:34:07+00:00,0.0,g1453101,137.4,0:20:00,,,,,,Run
1107994142,Evening Ride,26538.6,0:51:59,Ride,8.509,2017-07-30 00:07:07+00:00,8.0,b1683032,151.4,0:55:00,883.7,,,283.3,,Ride
1111290364,Afternoon Ride,33412.7,1:09:04,Ride,8.063,2017-07-31 22:59:44+00:00,58.6,b1683032,150.7,1:12:42,1096.9,,,264.7,,Ride
1114344648,Lunch Ride,43974.3,1:28:36,Ride,8.272,2017-08-02 17:53:47+00:00,14.3,b1683032,148.3,1:31:06,1455.0,,,273.7,,Ride
1117482522,Afternoon Run,3656.9,0:33:37,Run,1.813,2017-08-04 21:36:11+00:00,46.4,g1453101,,0:58:55,,,,,,Run
1121147896,Evening Run,1090.2,0:08:17,Run,2.194,2017-08-07 01:10:04+00:00,3.0,g1453101,,0:10:21,,,,,,Run
1140044347,Morning Ride,76911.3,3:20:46,Ride,6.385,2017-08-18 13:48:04+00:00,156.9,b1683032,119.5,3:35:47,1806.2,,,149.9,,Ride
1153373194,Morning Ride,58419.1,2:16:15,Ride,7.146,2017-08-26 13:28:30+00:00,428.8,b1683032,149.1,2:34:51,1865.2,,,228.2,,Ride
1155560434,Afternoon Ride,43639.0,1:32:12,Ride,7.888,2017-08-27 18:25:50+00:00,81.2,b1683032,149.8,1:32:53,1403.4,,,253.7,,Ride
1160634026,Evening Ride,43986.8,1:26:48,Ride,8.446,2017-08-30 22:00:50+00:00,93.1,b1683032,151.9,1:26:48,1494.8,,,287.0,,Ride
1163566260,Stupid walk,4869.9,0:44:32,Run,1.823,2017-09-01 23:03:43+00:00,8.1,g1453101,,1:01:19,,,,,,Run
1164661209,Morning Ride,70527.7,2:09:00,Ride,9.112,2017-09-02 13:10:07+00:00,112.7,b1683032,164.4,2:25:02,2519.5,,,325.5,,Ride
1215588970,Evening Run,5176.7,0:44:26,Run,1.942,2017-10-04 22:35:04+00:00,9.6,g1453101,,0:48:24,,,,,,Run
1429242763,Afternoon Ride,26419.3,0:56:02,Ride,7.858,2018-02-27 22:14:36+00:00,60.0,b1683032,143.0,0:56:02,873.8,,,259.9,,Ride
1434623921,Afternoon Ride,43735.9,1:37:12,Ride,7.499,2018-03-03 18:55:36+00:00,81.1,b1683032,142.7,1:42:55,1361.7,,,233.5,,Ride
1458069814,Afternoon Ride,45417.8,1:38:17,Ride,7.702,2018-03-17 17:49:31+00:00,80.0,b1683032,153.0,2:03:45,1409.3,,,239.0,,Ride
1458059548,Battery died,5451.5,0:15:06,Ride,6.017,2018-03-17 19:54:36+00:00,16.8,b1683032,,0:16:21,175.6,,,193.9,,Ride
1460209242,Afternoon Ride,79638.7,3:03:03,Ride,7.251,2018-03-18 17:38:31+00:00,151.4,b1683032,151.0,4:04:58,2408.1,,,219.3,,Ride
1466587001,Evening Ride with intervals,35895.8,1:19:23,Ride,7.536,2018-03-22 22:05:28+00:00,59.7,b1683032,134.8,1:20:15,1100.3,,,231.0,,Ride
1473806385,Could the wind let the fuck up!!!,43723.1,1:35:46,Ride,7.609,2018-03-26 21:35:49+00:00,81.5,b1683032,146.5,1:37:32,1375.2,,,239.3,,Ride
1479649909,fingers couldn't take the cold,2501.2,0:06:06,Ride,6.834,2018-03-30 12:17:44+00:00,7.0,b1683032,85.7,0:11:47,69.7,,,190.4,,Ride
1480565300,Afternoon Ride,43166.9,1:36:21,Ride,7.467,2018-03-30 20:30:13+00:00,72.4,b1683032,159.4,1:41:05,1326.4,,,229.4,,Ride
1488102315,Kure beach,45580.6,1:36:02,Ride,7.911,2018-04-03 20:47:59+00:00,54.4,b1683032,169.4,1:41:22,1528.5,,,265.3,,Ride
1489401740,Morning Ride,24452.7,0:52:57,Ride,7.697,2018-04-04 13:34:57+00:00,23.9,b1683032,147.4,1:05:19,796.1,,,250.6,,Ride
1489286215,Dougnut walk,1994.4,0:22:37,Run,1.47,2018-04-04 16:22:46+00:00,10.1,g1453101,,0:39:32,,,,,,Run
1490873829,Coffee walk,6529.3,1:22:04,Run,1.326,2018-04-05 13:49:47+00:00,14.8,g1453101,,1:23:52,,,,,,Run
1493168194,Morning Ride,41975.5,1:25:10,Ride,8.214,2018-04-06 14:23:48+00:00,30.8,b1683032,,1:28:07,1379.7,,,270.0,,Ride
1503341480,Evening Ride,43753.2,1:35:13,Ride,7.659,2018-04-11 22:35:08+00:00,78.1,b1683032,148.3,1:36:20,1356.5,,,237.4,,Ride
1505068859,"intervals to sandford, cruise back home",36236.9,1:18:13,Ride,7.721,2018-04-12 21:33:22+00:00,59.3,b1683032,137.7,1:22:54,1126.8,,,240.1,,Ride
1519285055,Evening Ride,50505.4,1:47:01,Ride,7.866,2018-04-19 22:19:44+00:00,85.9,b1683032,158.9,1:47:17,1594.8,,,248.4,,Ride
1521095192,Afternoon Ride,63784.6,2:25:55,Ride,7.286,2018-04-20 21:30:11+00:00,105.6,b1683032,154.3,2:27:46,1912.7,,,218.5,,Ride
1522876135,Morning Ride,63930.5,2:14:01,Ride,7.951,2018-04-21 13:51:50+00:00,97.8,b1683032,155.1,2:37:36,1999.9,,,248.7,,Ride
1527877177,Evening Ride,25845.3,0:51:12,Ride,8.413,2018-04-23 22:48:23+00:00,41.8,b1683032,153.8,0:51:12,876.3,,,285.3,,Ride
1537760586,Morning Ride,156680.0,5:31:14,Ride,7.884,2018-04-28 11:56:05+00:00,594.6,b1683032,149.1,9:54:53,5252.9,,,264.3,,Ride
1537341550,Afternoon Ride,1923.7,0:08:56,Ride,3.589,2018-04-28 18:16:07+00:00,7.8,b1683032,,0:10:10,53.9,,,100.6,,Ride
1540176928,Morning Ride,92104.9,3:22:32,Ride,7.579,2018-04-29 12:39:10+00:00,608.0,b1683032,136.6,4:15:52,3197.9,,,263.2,,Ride
1546182738,Evening Ride,27466.7,0:54:58,Ride,8.328,2018-05-02 22:50:50+00:00,48.4,b1683032,,0:54:58,904.3,,,274.2,,Ride
1579105805,Afternoon Ride,40639.8,1:21:09,Ride,8.347,2018-05-17 21:46:20+00:00,83.9,b1683032,147.9,1:27:08,1364.8,,,280.3,,Ride
1585622161,Evening Ride,43740.4,1:31:58,Ride,7.927,2018-05-20 23:10:05+00:00,78.4,b1683032,148.0,1:32:43,1407.8,,,255.1,,Ride
1592144916,Evening Ride,73316.9,2:37:51,Ride,7.741,2018-05-23 22:01:51+00:00,143.2,b1683032,154.9,2:39:57,2304.7,,,243.3,,Ride
1594199394,Afternoon Ride,72759.8,2:43:18,Ride,7.426,2018-05-24 21:58:35+00:00,126.1,b1683032,156.9,2:46:40,2183.7,,,222.9,,Ride
1597555376,Morning Ride,58611.8,2:08:41,Ride,7.591,2018-05-26 13:53:57+00:00,98.3,b1683032,154.1,2:48:28,1772.9,,,229.6,,Ride
1600733638,"F'ing lazy, road 10 miles without hands",41328.2,1:39:51,Ride,6.898,2018-05-27 23:18:14+00:00,81.7,b1683032,,1:40:11,1220.3,,,203.7,,Ride
1617712547,Afternoon Ride,58552.3,2:05:37,Ride,7.769,2018-06-04 21:40:49+00:00,95.2,b1683032,154.3,2:06:22,1823.6,,,242.0,,Ride
1628317288,First half of BikeMS 100,96524.6,3:38:23,Ride,7.367,2018-06-09 11:53:31+00:00,354.2,b1683032,,4:53:04,2932.9,,,223.8,,Ride
1627957836,Second half 100,75732.0,3:04:29,Ride,6.842,2018-06-09 16:14:50+00:00,275.9,b1683032,,3:36:58,2272.4,,,205.3,,Ride
1630104076,Morning Ride,47837.3,1:44:59,Ride,7.594,2018-06-10 11:10:57+00:00,68.1,b1683032,,1:54:31,1477.9,,,234.6,,Ride
1632841605,Evening Ride,43734.7,1:34:18,Ride,7.73,2018-06-11 23:12:54+00:00,81.0,b1683032,144.0,1:34:58,1375.6,,,243.1,,Ride
1642438404,Evening Ride,41300.0,1:28:00,Ride,7.822,2018-06-13 22:40:17+00:00,82.8,b1683032,139.4,1:29:46,1311.7,,,248.4,,Ride
1642382220,Morning Ride,36073.8,1:17:45,Ride,7.733,2018-06-16 14:36:11+00:00,59.8,b1683032,144.7,1:18:59,1118.7,,,239.8,,Ride
1647494733,Lunch Ride,48280.3,1:50:00,Ride,7.315,2018-06-17 16:00:00+00:00,0.0,b1683032,,1:50:00,,,,,,Ride
1647478039,Stationary Bike - shit weather,0.0,0:54:09,Ride,0.0,2018-06-19 00:11:52+00:00,0.0,b5274657,126.9,0:54:09,,,,,,Ride
1649652348,Evening Ride,46127.6,1:44:55,Ride,7.328,2018-06-19 22:22:39+00:00,90.0,b1683032,142.6,2:02:49,1488.9,,,236.5,,Ride
1653881631,Evening Ride,44486.1,1:34:28,Ride,7.849,2018-06-21 22:33:53+00:00,73.0,b1683032,147.5,1:34:54,1441.8,,,254.4,,Ride
1655701811,Afternoon Ride,74480.9,2:41:40,Ride,7.678,2018-06-22 21:50:34+00:00,89.0,b1683032,143.8,2:44:56,2307.6,,,237.9,,Ride
1662394154,Evening Activity,0.0,0:24:19,Workout,0.0,2018-06-26 00:31:35+00:00,0.0,,89.8,0:24:19,,,,,,Workout
1662394359,Evening Ride,0.0,0:26:05,Ride,0.0,2018-06-26 00:58:07+00:00,0.0,b5274657,151.1,0:26:05,,,,,,Ride
1664667215,Night Walk,1393.5,0:28:57,Walk,0.802,2018-06-27 01:01:52+00:00,8.0,g1453101,75.2,0:31:09,,,47.3,,,Walk
1668804649,Evening Ride,62505.7,2:18:13,Ride,7.537,2018-06-28 22:39:04+00:00,67.0,b1683032,157.6,2:19:35,1912.6,,73.8,230.6,,Ride
1671803741,Morning Ride,80617.3,3:03:32,Ride,7.321,2018-06-30 10:45:23+00:00,95.0,b1683032,156.1,3:19:08,2376.5,,72.7,215.8,,Ride
1674632955,Lunch Swim,800.0,0:13:42,Swim,0.973,2018-07-01 15:41:36+00:00,0.0,,,0:36:45,,,23.1,,,Swim
1674633078,Lunch Swim,180.8,0:04:44,Swim,0.637,2018-07-01 16:18:47+00:00,0.0,,,0:04:44,,,0.0,,,Swim
1674633132,Lunch Swim,200.0,0:03:50,Swim,0.87,2018-07-01 16:31:21+00:00,0.0,,,0:04:06,,,,,,Swim
1674633257,Lunch Swim,450.0,0:06:56,Swim,1.082,2018-07-01 16:32:34+00:00,0.0,,,0:13:42,,,22.7,,,Swim
1676369257,Lunch Swim,1550.0,0:42:49,Swim,0.603,2018-07-02 15:49:48+00:00,0.0,,,1:01:26,,,24.4,,,Swim
1678499155,Lunch Swim,2150.0,0:37:20,Swim,0.96,2018-07-03 15:48:29+00:00,0.0,,,0:57:49,,,32.5,,,Swim
1679134861,Afternoon Ride,41654.8,1:31:25,Ride,7.594,2018-07-03 19:56:40+00:00,55.0,b1683032,150.7,1:32:54,1277.4,,72.7,232.9,,Ride
1680508665,Morning Ride,81193.6,2:50:55,Ride,7.917,2018-07-04 11:57:08+00:00,97.0,b1683032,137.0,3:12:59,2557.9,,69.0,249.4,,Ride
1683018394,Lunch Swim,600.0,0:05:04,Swim,1.974,2018-07-05 15:46:14+00:00,0.0,,,0:08:28,,,23.4,,,Swim
1683018649,Lunch Swim,1950.0,0:35:47,Swim,0.908,2018-07-05 15:56:14+00:00,0.0,,,0:48:10,,,26.0,,,Swim
1683578244,Afternoon Walk,5514.0,1:02:21,Walk,1.474,2018-07-05 21:56:56+00:00,2.0,g1453101,96.1,1:08:14,,,55.3,,,Walk
1683796797,Evening Walk,6527.8,1:20:16,Walk,1.355,2018-07-05 23:48:58+00:00,12.0,g1453101,91.1,2:38:36,,,51.3,,,Walk
1684876594,Lunch Swim,1600.0,0:19:48,Swim,1.347,2018-07-06 15:43:52+00:00,0.0,,,0:21:33,,,22.6,,,Swim
1684876742,Lunch Swim,1650.0,0:30:41,Swim,0.896,2018-07-06 16:07:41+00:00,0.0,,,0:38:11,,,24.6,,,Swim
1685300360,Afternoon Ride,30151.7,1:03:06,Ride,7.964,2018-07-06 20:41:01+00:00,25.0,b1683032,146.3,1:06:38,959.0,,74.8,253.3,,Ride
1685413087,Afternoon Ride,43638.6,1:39:26,Ride,7.315,2018-07-06 21:48:17+00:00,33.0,b1683032,145.7,1:43:38,1288.5,,73.9,216.0,,Ride
1689499542,Lunch Swim,2850.0,0:53:35,Swim,0.886,2018-07-08 15:39:47+00:00,0.0,,,1:07:00,,,22.8,,,Swim
1692259227,Evening Swim,2050.0,0:35:20,Swim,0.967,2018-07-09 23:09:56+00:00,0.0,,,0:53:31,,,26.0,,,Swim
1693679040,Lunch Swim,2050.0,0:39:16,Swim,0.87,2018-07-10 15:57:01+00:00,0.0,,,0:50:41,,,23.5,,,Swim
1696595481,Evening Ride,43865.1,1:36:56,Ride,7.542,2018-07-11 22:19:07+00:00,54.0,b1683032,144.2,1:40:23,1337.4,,73.5,229.9,,Ride
3362079293,Afternoon Ride,19206.9,0:55:15,Ride,5.794,2018-07-12 21:45:17+00:00,18.0,b1683032,82.7,1:00:34,487.3,,,147.0,,Ride
1698700696,Afternoon Ride,23845.6,1:11:00,Ride,5.598,2018-07-12 21:45:39+00:00,32.0,b1683032,84.5,1:16:22,614.3,,55.4,144.2,,Ride
1698803802,Evening Swim,2350.0,0:45:55,Swim,0.853,2018-07-12 23:15:19+00:00,0.0,,,0:54:56,,,23.9,,,Swim
1700247024,Lunch Swim,1000.0,0:20:00,Swim,0.833,2018-07-13 15:48:03+00:00,0.0,,,0:22:22,,,45.7,,,Swim
1700247133,Lunch Swim,700.0,0:11:59,Swim,0.974,2018-07-13 16:11:28+00:00,0.0,,,0:14:22,,,25.7,,,Swim
1702577503,Lunch Ride,62003.0,2:11:05,Ride,7.883,2018-07-14 16:19:28+00:00,60.0,b1683032,147.9,2:11:33,1951.0,,76.5,248.1,,Ride
1704813139,Lunch Swim,1000.0,0:20:42,Swim,0.805,2018-07-15 15:42:38+00:00,0.0,,,0:23:03,,,25.5,,,Swim
1704813353,Lunch Swim,600.0,0:09:58,Swim,1.003,2018-07-15 16:07:40+00:00,0.0,,,0:13:48,,,24.8,,,Swim
1704813477,Lunch Swim,900.0,0:13:54,Swim,1.079,2018-07-15 16:23:02+00:00,0.0,,,0:25:12,,,22.1,,,Swim
1705540363,Evening Ride,41644.2,1:35:12,Ride,7.291,2018-07-15 23:44:22+00:00,47.0,b1683032,138.4,1:35:12,1218.3,,73.2,213.3,,Ride
1706646787,Lunch Swim,3050.0,0:50:35,Swim,1.005,2018-07-16 15:44:54+00:00,0.0,,,1:02:24,,,30.9,,,Swim
1707515495,Evening Ride,45739.6,1:37:52,Ride,7.789,2018-07-16 23:25:11+00:00,14.0,b1683032,143.7,1:38:34,1395.3,,73.4,237.6,,Ride
1708831245,Lunch Swim,2300.0,0:50:27,Swim,0.76,2018-07-17 15:53:17+00:00,0.0,,,1:02:48,,,25.4,,,Swim
1709763547,Afternoon Ride,71851.5,2:33:50,Ride,7.785,2018-07-17 21:11:37+00:00,120.0,b1683032,141.8,3:00:30,2306.7,,73.5,249.9,,Ride
1711435710,Lunch Walk,3411.8,0:58:04,Walk,0.979,2018-07-18 16:10:31+00:00,96.0,g1453101,94.3,1:23:53,,,50.0,,,Walk
1712190816,Afternoon Walk,1429.7,0:22:36,Walk,1.054,2018-07-18 19:11:51+00:00,8.0,g1453101,74.5,0:47:17,,,47.9,,,Walk
1712191448,Afternoon Walk,5420.8,1:13:26,Walk,1.23,2018-07-18 20:18:55+00:00,66.0,g1453101,87.5,1:30:11,,,51.5,,,Walk
1718163752,Morning Ride,158514.0,5:34:20,Ride,7.902,2018-07-21 11:00:26+00:00,492.0,b1683032,147.6,6:23:10,4998.0,,75.7,249.2,,Ride
1718185378,Afternoon Ride,2506.0,0:08:41,Ride,4.81,2018-07-21 17:24:45+00:00,1.0,b1683032,120.0,0:09:03,64.3,,47.5,123.4,,Ride
1720668066,Morning Ride,124458.0,4:38:31,Ride,7.448,2018-07-22 11:01:56+00:00,414.0,b1683032,132.6,5:18:52,3778.7,,72.1,226.1,,Ride
1729379917,Morning Ride,33394.3,1:10:45,Ride,7.867,2018-07-26 15:26:13+00:00,53.0,b1683032,154.7,1:19:55,1067.4,,79.9,251.5,,Ride
1732177292,Fucking off by the swamps,20771.0,0:45:04,Ride,7.682,2018-07-28 00:05:44+00:00,3.0,b1683032,141.7,0:47:43,627.8,,,232.2,,Ride
1738994301,Evening Ride,31585.0,1:04:53,Ride,8.113,2018-07-30 23:29:40+00:00,10.0,b1683032,152.9,1:09:26,1028.9,,74.2,264.3,,Ride
1741320066,Afternoon Ride,37932.0,1:20:19,Ride,7.871,2018-07-31 22:54:59+00:00,47.0,b1683032,150.7,1:20:19,1195.4,,76.8,248.1,,Ride
1755033387,First time on a pelaton,0.0,1:07:52,Ride,0.0,2018-08-07 00:34:49+00:00,0.0,b5274657,145.8,1:07:52,,,,,,Ride
1759531128,Evening Ride,55854.5,1:58:14,Ride,7.873,2018-08-08 22:04:10+00:00,58.0,b1683032,160.1,1:59:02,1737.1,,76.0,244.9,,Ride
1762961162,Lunch Swim,1900.0,0:39:37,Swim,0.799,2018-08-10 15:49:32+00:00,0.0,,,1:10:54,,,,,,Swim
1763510041,Afternoon Ride,41877.3,1:25:03,Ride,8.206,2018-08-10 21:48:46+00:00,49.0,b1683032,166.0,1:25:03,1326.7,,78.4,260.0,,Ride
1763534745,Evening Ride,8643.5,0:22:31,Ride,6.398,2018-08-10 23:14:35+00:00,20.0,b1683032,151.7,0:22:57,253.1,,71.1,187.3,,Ride
1768093380,Afternoon Ride,43752.9,1:35:59,Ride,7.597,2018-08-12 18:16:29+00:00,59.0,b1683032,150.4,1:37:00,1367.7,,76.4,237.5,,Ride
1770461678,15 Min Climb Ride with Hannah Marie Corbin,9656.0,0:14:59,Ride,10.741,2018-08-14 00:48:22+00:00,0.0,b5274657,,0:14:59,249.9,,70.2,278.0,285,Ride
1770512251,45 min Hip Hop Ride with Hannah Marie Corbin,23448.1,0:44:58,Ride,8.691,2018-08-14 01:07:09+00:00,0.0,b5274657,,0:44:58,519.6,,63.3,192.6,228,Ride
1777224402,45 min Tabata Ride with Robin Arzon,28404.9,0:44:58,Ride,10.528,2018-08-16 22:02:52+00:00,0.0,b5274657,,0:44:58,731.2,,71.0,271.0,296,Ride
1780799662,Morning Ride,74498.4,2:40:15,Ride,7.748,2018-08-18 12:54:41+00:00,111.0,b1683032,152.8,2:40:15,2343.0,,78.0,243.7,,Ride
1783835481,Afternoon Ride,43749.7,1:31:38,Ride,7.957,2018-08-19 17:20:40+00:00,62.0,b1683032,150.3,1:31:57,1426.6,,77.3,259.5,,Ride
1786365274,7 min 18 sec Just Ride,4168.2,0:07:18,Ride,9.516,2018-08-21 00:20:00+00:00,0.0,b5274657,,0:07:18,90.2,,74.4,206.0,205,Ride
1786417824,45 min Groove Ride with Cody Rigsby,27922.1,0:44:57,Ride,10.353,2018-08-21 00:30:52+00:00,0.0,b5274657,,0:44:57,695.2,,76.1,257.8,276,Ride
1787669316,Lunch Walk,1147.4,0:15:12,Walk,1.258,2018-08-21 15:55:24+00:00,0.0,g1453101,97.8,0:15:12,,,48.4,,,Walk
1790033001,Lunch Walk,985.4,0:13:44,Walk,1.196,2018-08-22 15:45:09+00:00,3.0,g1453101,107.4,0:14:27,,,47.9,,,Walk
1795128356,Evening Ride,0.0,1:01:49,Ride,0.0,2018-08-24 22:51:27+00:00,0.0,b5274657,154.6,1:01:49,,,,,,Ride
1799664900,Afternoon Ride,82343.8,3:00:45,Ride,7.593,2018-08-26 17:16:36+00:00,138.0,b1683032,160.2,3:04:12,2606.0,,72.9,240.3,,Ride
1801159076,Lunch Walk,1135.4,0:14:25,Walk,1.313,2018-08-27 16:39:36+00:00,1.0,g1453101,84.6,0:14:25,,,50.4,,,Walk
1806610500,45 min 90s Ride with Hannah Marie Corbin,26618.5,0:45:12,Ride,9.815,2018-08-30 00:59:28+00:00,0.0,b5274657,,0:45:12,624.9,,73.3,230.4,237,Ride
1819968014,60 min Metrics Ride with Hannah Marie Corbin,26859.9,0:46:58,Ride,9.532,2018-09-04 22:47:18+00:00,0.0,b5274657,,0:46:58,619.3,,74.7,219.8,245,Ride
1822256917,Evening Ride,0.0,0:54:13,Ride,0.0,2018-09-05 22:56:09+00:00,0.0,b5274657,158.8,0:54:13,,,,,,Ride
1828543692,Afternoon Ride,53858.4,1:55:49,Ride,7.751,2018-09-08 21:01:35+00:00,67.0,b1683032,157.9,1:56:18,1739.3,,75.2,250.3,,Ride
1831138695,Afternoon Ride windy AF,75180.9,2:43:56,Ride,7.643,2018-09-09 17:32:33+00:00,145.0,b1683032,161.3,3:22:17,2380.9,,74.6,242.1,,Ride
1833417823,Evening Swim,2103.1,0:51:14,Swim,0.684,2018-09-11 00:45:04+00:00,0.0,,,1:02:11,,,21.6,,,Swim
1834671973,Lunch Walk,1741.4,0:19:24,Walk,1.496,2018-09-11 16:20:20+00:00,5.0,g1453101,95.6,0:19:24,,,53.7,,,Walk
1835580992,Evening Ride,32475.0,1:08:39,Ride,7.884,2018-09-11 22:28:31+00:00,56.0,b1683032,139.7,1:08:39,1080.5,,72.6,262.3,,Ride
1837825721,Afternoon Ride,53841.9,1:55:26,Ride,7.774,2018-09-12 21:52:20+00:00,56.0,b1683032,142.9,1:57:16,1740.4,,72.9,251.3,,Ride
1841674543,Afternoon Activity,0.0,0:11:32,Workout,0.0,2018-09-14 21:56:58+00:00,0.0,,65.7,0:11:32,,,,,,Workout
1841709311,30 min Pick-Me-Up Ride with Hannah Marie Corbin,16994.6,0:29:59,Ride,9.447,2018-09-14 22:13:08+00:00,0.0,b5274657,,0:29:59,357.0,,76.0,198.5,209,Ride
1845859928,Morning Activity,0.0,0:48:38,Workout,0.0,2018-09-16 14:38:21+00:00,0.0,,99.3,0:48:38,,,,,,Workout
1846049964,Lunch Activity,0.0,0:34:23,Workout,0.0,2018-09-16 15:53:42+00:00,0.0,,91.9,0:34:23,,,,,,Workout
1846175491,Lunch Walk,1525.5,0:18:05,Walk,1.406,2018-09-16 16:54:24+00:00,0.0,g1453101,96.4,0:18:05,,,53.1,,,Walk
1846589469,Afternoon Activity,0.0,0:15:27,Workout,0.0,2018-09-16 20:13:25+00:00,0.0,,92.5,0:15:27,,,,,,Workout
1851022222,Evening Ride,41603.6,1:26:48,Ride,7.988,2018-09-18 22:14:51+00:00,51.0,b1683032,146.4,1:27:19,1348.5,,75.4,258.9,,Ride
1853264473,Evening Ride,36211.4,1:19:53,Ride,7.555,2018-09-19 22:25:25+00:00,39.0,b1683032,133.9,1:21:41,1120.1,,71.4,233.7,,Ride
1855269336,Evening Activity,0.0,0:18:34,Workout,0.0,2018-09-20 22:41:07+00:00,0.0,,69.7,0:18:34,,,,,,Workout
1855334456,45 min Rhythm Ride with Hannah Marie Corbin,23480.3,0:44:58,Ride,8.703,2018-09-20 23:06:31+00:00,0.0,b5274657,,0:44:58,429.2,,73.4,159.1,163,Ride
1863876011,60 min Football Pregame Ride with Hannah Marie Corbin,35373.3,0:59:58,Ride,9.831,2018-09-25 00:36:09+00:00,0.0,b5274657,,0:59:58,832.1,,76.9,231.3,248,Ride
1865841146,Evening Ride,24628.0,0:48:16,Ride,8.504,2018-09-25 22:27:33+00:00,68.0,b1683032,153.4,0:48:16,880.8,,76.2,304.1,,Ride
1870008449,Afternoon Ride,45594.9,1:49:08,Ride,6.963,2018-09-27 21:16:24+00:00,62.0,b1683032,124.1,2:00:20,1427.5,,66.9,218.0,,Ride
1873766210,Morning Ride,160975.0,6:07:18,Ride,7.304,2018-09-29 11:38:01+00:00,518.0,b1683032,133.8,7:35:52,4935.2,,65.8,223.9,,Ride
1876313879,Morning Ride 40 degrees and raining for 5 hours,160998.0,5:53:28,Ride,7.591,2018-09-30 11:38:45+00:00,265.0,b1683032,136.8,7:15:53,5049.3,,,238.1,,Ride
1878603374,Evening Swim,2308.9,0:43:00,Swim,0.895,2018-10-02 00:44:09+00:00,0.0,,,0:49:54,,,22.0,,,Swim
1880523964,Evening Activity,0.0,0:18:41,Workout,0.0,2018-10-02 22:33:19+00:00,0.0,,106.1,0:18:41,,,,,,Workout
1880501115,30 min 90s Rock Ride with Jennifer Jacobs,7113.3,0:13:55,Ride,8.519,2018-10-02 22:59:43+00:00,0.0,b5274657,,0:13:55,123.3,,71.6,147.7,145,Ride
1884607664,Afternoon Ride,43816.0,1:34:22,Ride,7.739,2018-10-04 21:27:58+00:00,53.0,b1683032,129.9,1:35:19,1370.0,,72.3,242.0,,Ride
1886259860,Afternoon Activity,0.0,0:20:09,Workout,0.0,2018-10-05 20:24:08+00:00,0.0,,103.5,0:20:09,,,,,,Workout
1886309022,45 min Live DJ Ride with Jess King,22965.3,0:40:46,Ride,9.389,2018-10-05 20:54:16+00:00,0.0,b5274657,,0:40:46,484.5,,77.3,198.1,210,Ride
1886333640,20 min Low Impact Ride with Jess King,3331.3,0:09:20,Ride,5.949,2018-10-05 21:32:48+00:00,0.0,b5274657,93.5,0:09:20,36.9,,59.9,65.9,71,Ride
1893093120,Evening Swim,2766.1,0:53:57,Swim,0.855,2018-10-09 00:42:05+00:00,0.0,,,1:09:32,,,18.0,,,Swim
1895138317,Dummy with dumbbells,0.0,0:25:32,Workout,0.0,2018-10-09 23:39:41+00:00,0.0,,114.7,0:25:32,,,,,,Workout
1895194654,45 min Classic Rock Ride with Jennifer Jacobs,27648.5,0:44:57,Ride,10.252,2018-10-10 00:12:16+00:00,0.0,b5274657,,0:44:57,663.4,,77.0,246.0,254,Ride
1895221502,20 min Low Impact Ride with Jess King,7724.8,0:19:56,Ride,6.459,2018-10-10 01:01:08+00:00,0.0,b5274657,135.5,0:19:56,99.2,,52.4,83.0,99,Ride
1897321328,Evening Swim,2628.9,0:45:51,Swim,0.956,2018-10-11 00:41:01+00:00,0.0,,,1:03:23,,,22.6,,,Swim
1900761197,Afternoon Activity,0.0,0:11:40,Workout,0.0,2018-10-12 21:58:28+00:00,0.0,,87.1,0:11:40,,,,,,Workout
1900789335,"Erg, kicking Olivias ass",0.0,0:16:39,Rowing,0.0,2018-10-12 22:18:16+00:00,0.0,,133.7,0:16:39,,,25.8,,,Rowing
1900827996,30 min Pop Ride with Emma Lovewell,16849.8,0:29:56,Ride,9.382,2018-10-12 22:41:25+00:00,0.0,b5274657,135.4,0:29:56,348.5,,68.5,194.0,202,Ride
1907429552,Evening Swim,2240.3,0:35:39,Swim,1.047,2018-10-16 00:44:14+00:00,0.0,,,0:57:09,,,20.6,,,Swim
1909634160,Afternoon Ride,43743.8,1:31:05,Ride,8.004,2018-10-16 21:42:28+00:00,57.0,b1683032,116.1,4:29:34,1444.0,,73.1,264.2,,Ride
1913231128,Afternoon Walk,5105.0,0:55:55,Walk,1.522,2018-10-18 20:30:43+00:00,21.0,g1453101,94.1,0:58:15,,,53.7,,,Walk
1913448755,Evening Activity,0.0,0:19:46,Workout,0.0,2018-10-18 23:59:25+00:00,0.0,,86.4,0:19:46,,,,,,Workout
1913503586,45 min 80s Ride with Jennifer Jacobs,27020.8,0:44:57,Ride,10.019,2018-10-19 00:26:46+00:00,0.0,b5274657,169.4,0:44:57,618.1,,72.7,229.2,237,Ride
1918804507,Morning Ride,29482.2,1:32:24,Ride,5.318,2018-10-21 12:39:20+00:00,36.0,b1683032,82.1,1:38:19,760.5,,47.9,137.2,,Ride
1919647846,Afternoon Activity,0.0,2:34:00,Workout,0.0,2018-10-21 17:50:43+00:00,0.0,,98.0,2:34:00,,,,,,Workout
1921833226,Evening Swim,2057.4,0:33:59,Swim,1.009,2018-10-23 00:42:46+00:00,0.0,,,1:10:06,,,22.2,,,Swim
1925733019,45 min Country Ride with Hannah Marie Corbin,28324.4,0:44:59,Ride,10.494,2018-10-25 00:30:52+00:00,0.0,b5274657,,0:44:59,697.8,,75.8,258.5,263,Ride
1925744762,10 min Cool Down Ride with Robin Arzon,1931.2,0:06:38,Ride,4.852,2018-10-25 01:18:32+00:00,0.0,b5274657,135.9,0:06:38,25.2,,42.2,63.2,65,Ride
1937617216,Lunch Walk,3669.6,0:47:04,Walk,1.299,2018-10-31 11:42:47+00:00,46.0,g1453101,81.4,1:04:12,,,51.9,,,Walk
1955182016,Evening Walk,1656.0,0:20:35,Walk,1.341,2018-11-09 18:32:45+00:00,1.0,g1453101,92.1,0:20:35,,,52.3,,,Walk
1956866137,Lunch Walk,14083.3,3:44:07,Walk,1.047,2018-11-10 10:38:25+00:00,54.0,g1453101,73.0,5:43:43,,,47.2,,,Walk
1971613225,Morning Walk,7038.0,1:49:49,Walk,1.068,2018-11-18 09:58:52+00:00,79.0,g1453101,91.4,2:14:42,,,52.5,,,Walk
1976242314,45 min Climb Ride with Jennifer Jacobs,23013.6,0:44:57,Ride,8.533,2018-11-20 23:09:43+00:00,0.0,b5274657,97.2,0:44:57,405.5,,66.4,150.4,153,Ride
1994713006,60 min HRZ Endurance Ride with Jennifer Jacobs,15594.5,0:28:49,Ride,9.019,2018-12-01 15:58:56+00:00,0.0,b5274657,,0:28:49,333.3,,67.7,192.8,215,Ride
2011028449,Evening Activity,0.0,1:07:11,Workout,0.0,2018-12-11 01:13:31+00:00,0.0,,84.8,1:07:11,,,,,,Workout
2011026608,45 min 80s Ride with Christine D'Ercole,25202.3,0:44:57,Ride,9.345,2018-12-11 01:34:35+00:00,0.0,b5274657,,0:44:57,552.4,,79.8,204.8,226,Ride
2012725353,30 min 80s Rock Ride with Christine D'Ercole,17493.5,0:29:58,Ride,9.729,2018-12-11 23:46:15+00:00,0.0,b5274657,,0:29:58,385.9,,76.3,214.6,224,Ride
2018613229,45 min 70s Ride with Hannah Marie Corbin,19778.8,0:35:29,Ride,9.29,2018-12-15 17:07:38+00:00,0.0,b5274657,4.9,0:35:29,514.2,,77.3,241.5,233,Ride
2022694489,Night Activity,0.0,0:36:44,Workout,0.0,2018-12-18 02:06:16+00:00,0.0,,122.0,0:36:44,,,,,,Workout
2024445437,Evening Activity,0.0,0:17:39,Workout,0.0,2018-12-19 00:50:06+00:00,0.0,,73.5,0:17:39,,,,,,Workout
2024353524,60 min HRZ Endurance Ride with Jennifer Jacobs,34262.9,0:59:59,Ride,9.52,2018-12-19 01:15:09+00:00,0.0,b5274657,88.3,0:59:59,795.2,,70.5,221.0,237,Ride
2033428578,Morning Swim,3406.1,1:22:04,Swim,0.692,2018-12-24 13:19:23+00:00,0.0,,,1:57:48,,,21.3,,,Swim
2036829165,Lunch Walk,1427.1,0:18:51,Walk,1.262,2018-12-26 17:24:18+00:00,13.0,g1453101,103.4,0:19:28,,,52.5,,,Walk
2042776820,20 min Beginner Ride with Jennifer Jacobs,11539.0,0:20:00,Ride,9.616,2018-12-29 18:42:49+00:00,0.0,b5274657,,0:20:00,245.3,,76.7,204.4,206,Ride
2042825973,30 min Intervals & Arms Ride with Hannah Marie Corbin,15369.2,0:31:18,Ride,8.184,2018-12-29 19:06:08+00:00,0.0,b5274657,165.4,0:31:18,348.9,,62.9,185.8,208,Ride
2046843699,Morning Activity,0.0,1:30:04,Workout,0.0,2018-12-31 14:47:44+00:00,0.0,,104.2,1:30:04,,,,,,Workout
2046800477,30 min Pop Ride with Jess King,17413.1,0:29:59,Ride,9.679,2018-12-31 15:30:50+00:00,0.0,b5274657,,0:29:59,389.7,,69.7,216.6,240,Ride
2046829634,10 min Cool Down with Leanne Hainsby,2510.6,0:06:57,Ride,6.021,2018-12-31 16:02:53+00:00,0.0,b5274657,,0:06:57,33.5,,56.8,80.3,88,Ride
2057627853,Morning Activity,0.0,1:11:47,Workout,0.0,2019-01-05 15:27:47+00:00,0.0,,147.4,1:11:47,,,,,,Workout
2063327502,60 min Metrics with Lisa Niren,35598.6,1:00:18,Ride,9.839,2019-01-08 01:07:21+00:00,0.0,b5274657,148.0,1:00:18,822.9,,80.0,227.5,248,Ride
2065709929,Evening Activity,0.0,1:05:32,Workout,0.0,2019-01-09 01:18:01+00:00,0.0,,141.1,1:05:32,,,,,,Workout
2065699916,30 min Disco Ride with Leanne Hainsby,18072.9,0:29:58,Ride,10.052,2019-01-09 01:44:57+00:00,0.0,b5274657,162.2,0:29:58,417.1,,76.1,232.0,240,Ride
2068035499,Evening Ride,0.0,1:32:28,Ride,0.0,2019-01-10 01:25:48+00:00,0.0,b5274657,125.2,1:32:28,,,,,,Ride
2067998375,45 min HRZ Power Ride with Christine D'Ercole,3009.5,0:08:54,Ride,5.636,2019-01-10 01:30:50+00:00,0.0,b5274657,113.7,0:08:54,83.7,,80.4,156.7,202,Ride
2068007490,10 min Cool Down Ride with Jess King,6228.2,0:09:58,Ride,10.415,2019-01-10 02:16:35+00:00,0.0,b5274657,152.2,0:09:58,150.5,,79.1,251.7,248,Ride
2068026639,19 min 2 sec Just Ride,7885.8,0:18:40,Ride,7.041,2019-01-10 02:28:45+00:00,0.0,b5274657,153.2,0:18:40,143.6,,69.3,128.2,145,Ride
2079383980,Evening Swim,2103.1,0:41:35,Swim,0.843,2019-01-15 01:42:20+00:00,0.0,,,1:06:30,,,23.2,,,Swim
2084024684,60 min Rock Ride with Hannah Marie Corbin,25636.8,0:44:53,Ride,9.52,2019-01-17 02:00:57+00:00,0.0,b5274657,152.1,0:44:53,592.7,,73.4,220.1,235,Ride
2086102917,45 min Intervals & Arms Ride with Leanne Hainsby,17895.9,0:31:14,Ride,9.55,2019-01-18 01:36:47+00:00,0.0,b5274657,119.5,0:31:14,389.8,,73.2,208.0,217,Ride
2086088560,30 min Hip Hop Ride with Ally Love,0.0,0:31:00,Workout,0.0,2019-01-18 06:34:39+00:00,0.0,,,0:31:00,,,,,,Workout
2104749114,Morning Activity,0.0,0:28:41,WeightTraining,0.0,2019-01-26 15:45:21+00:00,0.0,,100.1,0:28:41,,,,,,WeightTraining
2104911682,Lunch Ride,0.0,1:00:22,Ride,0.0,2019-01-26 16:17:20+00:00,0.0,b5274657,158.9,1:00:22,,,,,,Ride
2104881521,45 min 90s Country Ride with Hannah Marie Corbin,27407.1,0:44:58,Ride,10.158,2019-01-26 16:20:47+00:00,0.0,b5274657,164.6,0:44:58,642.0,,70.7,238.0,245,Ride
2104925214,15 min Low Impact Ride with Jennifer Jacobs,5359.1,0:13:26,Ride,6.649,2019-01-26 17:09:25+00:00,0.0,b5274657,139.3,0:13:26,69.0,,52.1,85.6,88,Ride
2112364392,60 min HRZ Endurance Ride with Jennifer Jacobs,23689.5,0:41:07,Ride,9.603,2019-01-30 00:04:25+00:00,0.0,b5274657,,0:41:07,519.4,,71.1,210.5,223,Ride
2116391672,Evening Activity,0.0,0:14:26,WeightTraining,0.0,2019-02-01 00:37:17+00:00,0.0,,81.8,0:14:26,,,,,,WeightTraining
2116458278,60 min Football Pregame Ride with Hannah Marie Corbin,35582.5,0:59:59,Ride,9.887,2019-02-01 00:54:17+00:00,0.0,b5274657,154.9,0:59:59,811.8,,64.8,225.6,239,Ride
2116469899,10 min Cool Down Ride with Robin Arzon,2285.3,0:07:35,Ride,5.023,2019-02-01 01:56:17+00:00,0.0,b5274657,123.3,0:07:35,25.5,,39.5,56.0,58,Ride
2119281088,Morning Ride,0.0,0:57:06,Ride,0.0,2019-02-02 14:02:54+00:00,0.0,b5274657,157.3,0:57:06,,,,,,Ride
2127149945,45 min Classic Rock Ride with Christine D'Ercole,26344.9,0:44:59,Ride,9.761,2019-02-06 00:30:50+00:00,0.0,b5274657,,0:44:59,575.9,,75.6,213.4,222,Ride
2127189493,30 min Premiere Ride with Olivia Amato,17348.7,0:29:59,Ride,9.644,2019-02-06 01:18:15+00:00,0.0,b5274657,,0:29:59,386.3,,67.4,214.7,232,Ride
2127203352,10 min Low Impact Ride with Emma Lovewell,1512.8,0:09:14,Ride,2.731,2019-02-06 01:50:45+00:00,0.0,b5274657,,0:09:14,21.8,,42.0,39.3,29,Ride
2131415344,60 min Double Trouble with Lisa  with Antonia DeSantis,30641.8,0:55:32,Ride,9.196,2019-02-07 23:59:50+00:00,0.0,b5274657,122.7,0:55:32,622.6,,70.7,186.8,191,Ride
2134566537,Morning Ride,0.0,1:07:10,Ride,0.0,2019-02-09 14:02:44+00:00,0.0,b5274657,165.8,1:07:10,,,,,,Ride
2140235295,Evening Activity,0.0,1:07:08,Workout,0.0,2019-02-12 01:34:44+00:00,0.0,,117.6,1:07:08,,,,,,Workout
2142375140,Evening Activity,0.0,0:21:07,Workout,0.0,2019-02-13 00:00:22+00:00,0.0,,101.3,0:21:07,,,,,,Workout
2142419765,30 min Intervals & Arms Ride with Ally Love,18201.6,0:29:58,Ride,10.123,2019-02-13 00:28:19+00:00,0.0,b5274657,78.8,0:29:58,426.0,,76.5,236.9,245,Ride
2147691553,Evening Ride,0.0,1:15:10,Ride,0.0,2019-02-14 00:58:00+00:00,0.0,b5274657,154.5,1:15:10,,,,,,Ride
2147678080,60 min Intervals & Arms Ride with Jennifer Jacobs,35727.4,0:59:58,Ride,9.93,2019-02-14 00:58:33+00:00,0.0,b5274657,160.4,0:59:58,811.5,,75.5,225.5,231,Ride
2147690276,10 min Cool Down Ride with Leanne Hainsby,1319.7,0:04:08,Ride,5.321,2019-02-14 02:02:21+00:00,0.0,b5274657,133.3,0:04:08,13.3,,53.5,53.6,56,Ride
2151698731,60 min HRZ Endurance Ride with Jennifer Jacobs,33715.7,0:59:59,Ride,9.368,2019-02-15 23:16:24+00:00,0.0,b5274657,107.1,0:59:59,769.5,,70.6,213.8,220,Ride
2151711015,5 min Cool Down Ride with Emma Lovewell,1013.9,0:04:53,Ride,3.46,2019-02-16 00:21:33+00:00,0.0,b5274657,128.7,0:04:53,11.6,,43.4,39.4,40,Ride
2153312183,Morning Activity,0.0,1:32:09,Workout,0.0,2019-02-16 14:16:36+00:00,0.0,,102.8,1:32:09,,,,,,Workout
2159260531,Evening Activity,0.0,1:13:53,Workout,0.0,2019-02-19 01:33:16+00:00,0.0,,118.4,1:13:53,,,,,,Workout
2166155638,60 min Metrics Ride with Nicole Meline,34793.9,0:59:59,Ride,9.668,2019-02-22 01:06:30+00:00,0.0,b5274657,,0:59:59,747.2,,75.4,207.6,210,Ride
2168069827,60 min 80s Ride with Jennifer Jacobs,29821.1,0:53:11,Ride,9.345,2019-02-23 00:00:22+00:00,0.0,b5274657,135.5,0:53:11,620.9,,71.7,194.6,204,Ride
2178286483,60 min Metrics with Jess King,36194.1,0:59:50,Ride,10.082,2019-02-27 01:22:03+00:00,0.0,b5274657,1.0,0:59:50,839.4,,73.0,233.8,239,Ride
2178297937,10 min Cool Down Ride with Olivia Amato,3701.5,0:09:20,Ride,6.61,2019-02-27 02:24:18+00:00,0.0,b5274657,75.6,0:09:20,50.7,,48.3,90.6,92,Ride
2194158283,45 min Intervals & Arms Ride with Jess King,28404.9,0:45:00,Ride,10.52,2019-03-06 01:50:13+00:00,0.0,b5274657,,0:45:00,702.8,,73.0,260.3,267,Ride
2196269172,Evening Swim,3017.5,0:44:42,Swim,1.125,2019-03-07 01:39:03+00:00,0.0,,,1:07:47,,,22.5,,,Swim
2198327202,60 min Football Pregame Ride with Hannah Marie Corbin,32524.8,0:59:59,Ride,9.037,2019-03-08 01:01:03+00:00,0.0,b5274657,125.3,0:59:59,625.5,,72.9,173.8,175,Ride
2198357239,30 min Women's History Ride with Jennifer Jacobs,13421.9,0:29:58,Ride,7.465,2019-03-08 02:03:21+00:00,0.0,b5274657,106.2,0:29:58,221.6,,61.1,123.3,140,Ride
2200216223,Evening Activity,0.0,1:35:00,Workout,0.0,2019-03-08 23:14:00+00:00,0.0,,135.1,1:35:00,,,,,,Workout
2200177544,45 min 80s Ride with Jennifer Jacobs,28533.6,0:44:58,Ride,10.576,2019-03-08 23:32:53+00:00,0.0,b5274657,160.4,0:44:58,714.4,,76.0,264.8,272,Ride
2200197564,15 min Warm Up Ride with Jennifer Jacobs,7563.9,0:14:59,Ride,8.414,2019-03-09 00:19:20+00:00,0.0,b1683032,134.8,0:14:59,135.9,,63.6,151.2,159,Ride
2207489243,Evening Swim,2537.5,0:39:06,Swim,1.082,2019-03-12 00:42:58+00:00,0.0,,,0:58:44,,,21.4,,,Swim
2209595025,Evening Activity,0.0,0:08:46,Workout,0.0,2019-03-12 23:20:41+00:00,0.0,,103.2,0:08:46,,,,,,Workout
2209651754,30 min Intervals & Arms Ride with Ally Love,19344.3,0:29:58,Ride,10.759,2019-03-12 23:33:36+00:00,0.0,b5274657,139.3,0:29:58,497.7,,68.4,276.8,282,Ride
2209676533,10 min Low Impact Ride with Olivia Amato,1963.4,0:07:10,Ride,4.566,2019-03-13 00:09:19+00:00,0.0,b5274657,111.4,0:07:10,20.6,,42.6,47.9,53,Ride
2211982251,Evening Swim,2926.1,0:44:03,Swim,1.107,2019-03-14 00:49:08+00:00,0.0,,,1:03:06,,,23.0,,,Swim
2215720558,Evening Activity,0.0,0:18:55,Workout,0.0,2019-03-15 22:10:26+00:00,0.0,,96.4,0:18:55,,,,,,Workout
2215765335,30 min HIIT Ride with Robin Arzon,17912.0,0:30:00,Ride,9.951,2019-03-15 22:33:26+00:00,0.0,b1683032,142.1,0:30:00,402.2,,76.5,223.4,228,Ride
2215812095,30 min 80s Rock Ride with Jennifer Jacobs,16785.4,0:29:58,Ride,9.336,2019-03-15 23:09:11+00:00,0.0,b1683032,155.6,0:29:58,365.1,,58.6,203.1,217,Ride
2217762750,30 min Advanced Beginner Ride with Jennifer Jacobs,18539.6,0:29:58,Ride,10.311,2019-03-16 17:36:56+00:00,0.0,b1683032,126.5,0:29:58,440.0,,77.2,244.7,249,Ride
2217833617,30 min HIIT Ride with Emma Lovewell,15739.3,0:29:58,Ride,8.754,2019-03-16 18:10:45+00:00,0.0,b1683032,150.6,0:29:58,318.6,,69.8,177.2,180,Ride
2223495298,Evening Swim,2446.0,0:38:50,Swim,1.05,2019-03-19 00:40:58+00:00,0.0,,,0:58:22,,,24.1,,,Swim
2225949540,45 min Pop Ride with Jennifer Jacobs,26023.0,0:44:58,Ride,9.645,2019-03-20 00:26:29+00:00,0.0,b1683032,134.2,0:44:58,559.5,,71.0,207.4,211,Ride
2226011243,45 min Pop Ride with Jess King,13180.5,0:29:30,Ride,7.447,2019-03-20 01:17:26+00:00,0.0,b1683032,119.1,0:29:30,220.4,,58.7,124.5,134,Ride
2228423778,Evening Swim,4000.5,1:04:29,Swim,1.034,2019-03-21 00:40:46+00:00,0.0,,,1:09:20,,,22.6,,,Swim
2239769588,Morning Ride,29601.6,1:08:15,Ride,7.229,2019-03-25 13:41:06+00:00,47.0,b1683032,139.4,1:44:09,961.1,,70.6,234.7,,Ride
2241912588,Morning Ride,50025.1,2:06:23,Ride,6.597,2019-03-26 11:19:15+00:00,107.0,b1683032,117.5,2:20:46,1488.5,,64.7,196.3,,Ride
2242279814,Lunch Activity,2346.6,0:32:57,Kayaking,1.187,2019-03-26 16:17:39+00:00,3.0,,96.6,0:34:01,,,,,,Kayaking
2243011491,Afternoon Ride,23115.1,0:53:23,Ride,7.217,2019-03-26 20:13:43+00:00,31.0,b1683032,140.3,0:58:26,726.6,,75.7,226.9,,Ride
2247411886,Lunch Activity,1588.1,0:11:25,Workout,2.318,2019-03-28 16:49:46+00:00,32.0,,76.5,0:55:50,,,,,,Workout
2248022596,Afternoon Walk,694.2,0:04:01,Walk,2.88,2019-03-28 21:23:03+00:00,73.0,g1453101,86.2,0:15:25,,,52.0,,,Walk
2267686679,60 min Rock Ride with Jenn Sherman,35389.4,0:59:58,Ride,9.836,2019-04-05 22:27:18+00:00,0.0,b5274657,112.3,0:59:58,803.5,,73.4,223.3,234,Ride
2267716148,20 min Low Impact Ride with Olivia Amato,8095.0,0:19:58,Ride,6.757,2019-04-05 23:31:07+00:00,0.0,b5274657,137.7,0:19:58,118.5,,54.7,99.0,107,Ride
2269920744,30 min 80s Pop Ride with Jennifer Jacobs,17509.6,0:29:57,Ride,9.744,2019-04-06 17:52:24+00:00,0.0,b5274657,141.4,0:29:57,386.8,,79.4,215.2,219,Ride
2269986168,30 min Intervals & Arms Ride with Robin Arzon,14870.3,0:29:59,Ride,8.266,2019-04-06 18:25:28+00:00,0.0,b5274657,159.7,0:29:59,269.7,,65.0,149.9,160,Ride
2275720342,Afternoon Ride,43013.9,1:30:04,Ride,7.96,2019-04-08 21:18:56+00:00,133.0,b1683032,151.5,1:33:40,1440.1,,76.0,266.5,,Ride
2275974027,Evening Swim,2560.3,1:08:15,Swim,0.625,2019-04-09 00:41:02+00:00,0.0,,,1:14:30,,,21.5,,,Swim
2283269316,30 min Pop Ride with Olivia Amato,18024.6,0:29:58,Ride,10.025,2019-04-12 00:40:21+00:00,0.0,b5274657,,0:29:58,421.8,,76.6,234.6,252,Ride
2283297322,20 min Beginner Ride with Leanne Hainsby,3122.1,0:07:07,Ride,7.312,2019-04-12 01:13:31+00:00,0.0,b5274657,104.4,0:07:07,48.2,,57.1,112.8,110,Ride
2285248771,Evening Ride,28654.7,1:04:25,Ride,7.414,2019-04-12 23:11:01+00:00,35.0,b1683032,155.3,1:04:25,837.3,,75.4,216.6,,Ride
2287724599,Afternoon Ride,52855.1,1:52:45,Ride,7.813,2019-04-13 19:45:20+00:00,76.0,b1683032,143.1,1:54:01,1685.0,,78.9,249.1,,Ride
2295486554,15 min HIIT Ride with Jennifer Jacobs,8899.7,0:14:59,Ride,9.9,2019-04-16 23:38:22+00:00,0.0,b1683032,,0:14:59,196.5,,77.3,218.6,216,Ride
2298245490,Evening Swim,2263.1,0:52:05,Swim,0.724,2019-04-18 00:42:39+00:00,0.0,,,1:11:23,,,20.7,,,Swim
2300582855,45 min Sweat Steady Ride with Jess King,24735.6,0:44:59,Ride,9.165,2019-04-18 23:23:25+00:00,0.0,b5274657,57.7,0:44:59,525.4,,71.5,194.7,206,Ride
2300617006,20 min Beginner Ride with Leanne Hainsby,7097.2,0:19:34,Ride,6.045,2019-04-19 00:12:11+00:00,0.0,b5274657,126.9,0:19:34,119.7,,51.2,102.0,101,Ride
2304997314,Morning Ride,50193.7,1:48:36,Ride,7.703,2019-04-20 13:34:51+00:00,69.0,b1683032,111.1,1:49:21,1591.8,,75.6,244.3,,Ride
2311507531,Evening Swim,2423.2,1:02:31,Swim,0.646,2019-04-23 00:52:23+00:00,0.0,,,1:02:35,,,23.5,,,Swim
2323514333,Morning Ride,161655.0,5:53:49,Ride,7.615,2019-04-27 11:14:50+00:00,672.0,b1683032,147.5,7:22:35,5473.9,,73.7,257.9,,Ride
2326203522,Morning Ride,112159.0,3:56:41,Ride,7.898,2019-04-28 12:29:12+00:00,660.0,b1683032,135.3,4:20:13,3974.7,,,279.9,,Ride
2337498545,45 min 90s Hip Hop Ride with Jess King,20084.6,0:38:57,Ride,8.594,2019-05-02 23:42:56+00:00,0.0,b5274657,64.7,0:38:57,369.6,,67.1,158.2,171,Ride
2347791258,Evening Ride,0.0,0:58:32,Ride,0.0,2019-05-07 00:00:14+00:00,0.0,b1683032,133.6,0:58:32,,,,,,Ride
2368381256,Evening Ride,43858.1,1:31:20,Ride,8.003,2019-05-14 22:26:56+00:00,64.0,b1683032,153.2,1:40:10,1433.6,,72.4,261.6,,Ride
2371042225,Afternoon Ride,41833.7,1:31:54,Ride,7.587,2019-05-15 21:25:57+00:00,35.0,b1683032,127.0,1:47:06,1296.0,,65.1,235.0,,Ride
2378026588,Lunch Ride,0.0,1:12:12,Ride,0.0,2019-05-18 16:46:38+00:00,0.0,b1683032,135.9,1:12:12,,,,,,Ride
2384094205,Evening Swim,1577.3,0:32:41,Swim,0.804,2019-05-21 00:56:23+00:00,0.0,,,0:34:07,,,22.9,,,Swim
2414953433,Morning Ride,114566.0,3:59:35,Ride,7.97,2019-06-01 11:23:59+00:00,442.0,b1683032,155.4,4:55:20,3782.1,,69.9,263.1,,Ride
2417731920,Morning Ride,80892.9,3:03:28,Ride,7.349,2019-06-02 11:05:34+00:00,165.0,b1683032,126.3,3:35:25,2486.5,,63.7,225.9,,Ride
2429659685,Evening Ride,48676.8,1:41:23,Ride,8.002,2019-06-06 22:00:42+00:00,57.0,b1683032,115.1,1:42:06,1614.7,,69.9,265.4,,Ride
2431694598,Afternoon Ride,43701.0,1:31:49,Ride,7.933,2019-06-07 19:55:51+00:00,63.0,b1683032,118.9,1:33:59,1454.6,,72.0,264.0,,Ride
2433801278,Lunch Swim,1800.0,0:33:29,Swim,0.896,2019-06-08 16:02:01+00:00,0.0,,,0:48:03,,,20.9,,,Swim
2437001553,Lunch Swim,2650.0,0:44:38,Swim,0.99,2019-06-09 15:55:32+00:00,0.0,,,0:56:06,,,20.8,,,Swim
2440225780,Afternoon Swim,1850.0,0:31:26,Swim,0.981,2019-06-10 21:41:52+00:00,0.0,,,0:50:17,,,24.5,,,Swim
2441940359,Lunch Swim,2500.0,0:42:12,Swim,0.987,2019-06-11 16:01:56+00:00,0.0,,,0:52:09,,,23.4,,,Swim
2442979407,Afternoon Ride,60123.9,2:02:22,Ride,8.189,2019-06-11 21:45:13+00:00,68.0,b1683032,149.3,2:09:01,2025.0,,69.7,275.8,,Ride
2444597955,Lunch Swim,2900.0,0:46:52,Swim,1.031,2019-06-12 15:56:55+00:00,0.0,,,0:57:26,,,25.6,,,Swim
2448236818,45 min 90s Pop Ride with Olivia Amato,26763.3,0:44:58,Ride,9.92,2019-06-14 00:39:38+00:00,0.0,b5274657,57.2,0:44:58,604.9,,74.5,224.2,232,Ride
2448255065,10 min Cool Down Ride with Hannah Marie Corbin,3653.2,0:09:56,Ride,6.13,2019-06-14 01:29:49+00:00,0.0,b5274657,,0:09:56,50.2,,51.9,84.2,86,Ride
2449621276,Lunch Swim,3100.0,0:51:56,Swim,0.995,2019-06-14 15:55:52+00:00,0.0,,,1:01:08,,,24.7,,,Swim
2450381625,Evening Ride,36780.2,1:14:56,Ride,8.181,2019-06-14 22:34:03+00:00,62.0,b1683032,137.6,1:16:34,1234.5,,66.1,274.6,,Ride
2451913294,Morning Walk,5047.2,0:38:59,Walk,2.158,2019-06-15 13:24:18+00:00,14.0,g1453101,134.2,0:40:37,,,71.8,,,Walk
2455363914,Lunch Swim,600.0,0:10:31,Swim,0.951,2019-06-16 15:46:58+00:00,0.0,,,0:12:19,,,22.9,,,Swim
2455469114,Lunch Swim,400.0,0:07:41,Swim,0.868,2019-06-16 16:03:23+00:00,0.0,,,0:13:12,,,21.1,,,Swim
2457778895,Lunch Swim,1250.0,0:24:24,Swim,0.854,2019-06-17 15:59:13+00:00,0.0,,,0:27:32,,,23.2,,,Swim
2457842194,Lunch Swim,1100.0,0:16:49,Swim,1.09,2019-06-17 16:19:10+00:00,0.0,,,0:20:38,,,24.3,,,Swim
2458894909,Afternoon Ride,65209.8,2:17:25,Ride,7.909,2019-06-17 21:38:30+00:00,62.0,b1683032,133.8,2:18:11,2058.0,,68.4,249.6,,Ride
2460496701,Lunch Swim,1050.0,0:17:12,Swim,1.017,2019-06-18 15:57:17+00:00,0.0,,,0:19:41,,,22.4,,,Swim
2460600024,Lunch Swim,2050.0,0:32:03,Swim,1.066,2019-06-18 16:13:32+00:00,0.0,,,0:35:37,,,25.2,,,Swim
2461809676,Afternoon Ride,74860.8,2:38:48,Ride,7.857,2019-06-18 21:58:39+00:00,117.0,b1683032,133.9,2:40:34,2353.9,,67.4,247.1,,Ride
2463354365,Lunch Swim,1500.0,0:26:44,Swim,0.935,2019-06-19 15:58:05+00:00,0.0,,,0:31:55,,,25.2,,,Swim
2463417719,Lunch Swim,900.0,0:14:02,Swim,1.069,2019-06-19 16:32:57+00:00,0.0,,,0:17:35,,,23.2,,,Swim
2466146022,Lunch Swim,2000.0,0:32:51,Swim,1.015,2019-06-20 15:54:09+00:00,0.0,,,0:38:29,,,26.6,,,Swim
2466146235,Lunch Swim,600.0,0:09:02,Swim,1.107,2019-06-20 16:26:30+00:00,0.0,,,0:11:59,,,25.6,,,Swim
2466146398,Lunch Swim,200.0,0:01:51,Swim,1.802,2019-06-20 16:40:41+00:00,0.0,,,0:02:04,,,12.0,,,Swim
2467158918,Evening Ride,47009.4,1:41:08,Ride,7.747,2019-06-20 22:25:44+00:00,42.0,b1683032,125.1,1:42:17,1450.0,,70.7,239.0,,Ride
2468699380,Lunch Swim,2450.0,0:38:28,Swim,1.062,2019-06-21 15:50:38+00:00,0.0,,,0:59:49,,,26.1,,,Swim
2475483312,Afternoon Ride,73297.4,2:32:47,Ride,7.996,2019-06-23 20:07:44+00:00,95.0,b1683032,141.2,2:34:26,2358.8,,72.1,257.3,,Ride
2476933371,Lunch Swim,2000.0,0:33:31,Swim,0.995,2019-06-24 15:52:57+00:00,0.0,,,0:33:45,,,26.4,,,Swim
2476977100,Lunch Swim,500.0,0:07:15,Swim,1.149,2019-06-24 16:26:56+00:00,0.0,,,0:09:47,,,28.0,,,Swim
2480638727,Afternoon Ride,36706.5,1:15:16,Ride,8.128,2019-06-25 21:40:17+00:00,67.0,b1683032,145.3,1:16:41,1232.9,,69.2,273.0,,Ride
2480705603,Evening Swim,900.0,0:14:20,Swim,1.047,2019-06-25 23:11:47+00:00,0.0,,,0:30:46,,,23.0,,,Swim
2482436269,Lunch Swim,2800.0,0:43:43,Swim,1.067,2019-06-26 15:57:20+00:00,0.0,,,0:53:53,,,25.5,,,Swim
2485102452,Lunch Swim,2300.0,0:38:56,Swim,0.985,2019-06-27 15:53:19+00:00,0.0,,,0:43:10,,,25.9,,,Swim
2485110753,Lunch Swim,900.0,0:13:50,Swim,1.084,2019-06-27 16:29:42+00:00,0.0,,,0:16:07,,,23.0,,,Swim
2486015545,Afternoon Ride,40455.9,1:23:23,Ride,8.086,2019-06-27 21:39:20+00:00,38.0,b1683032,144.3,1:24:09,1282.0,,73.6,256.2,,Ride
2486046777,Evening Ride,5447.4,0:12:01,Ride,7.555,2019-06-27 23:12:31+00:00,19.0,b1683032,127.9,0:12:01,186.3,,66.0,258.4,,Ride
2488526369,Afternoon Swim,2550.0,0:41:52,Swim,1.015,2019-06-28 21:52:56+00:00,0.0,,,0:57:30,,,25.2,,,Swim
2490389711,Lunch Swim,3000.0,0:49:39,Swim,1.007,2019-06-29 15:56:09+00:00,0.0,,,0:55:51,,,25.7,,,Swim
2491216031,Afternoon Ride,77040.6,2:47:29,Ride,7.666,2019-06-29 21:39:30+00:00,123.0,b1683032,141.3,2:59:42,2386.8,,72.1,237.5,,Ride
2492899591,Lunch Swim,1550.0,0:27:31,Swim,0.939,2019-06-30 15:46:48+00:00,0.0,,,0:55:10,,,22.9,,,Swim
2495487178,Lunch Swim,3050.0,0:48:07,Swim,1.056,2019-07-01 15:52:30+00:00,0.0,,,0:54:33,,,25.2,,,Swim
2496477002,Afternoon Ride,54510.5,1:54:01,Ride,7.968,2019-07-01 21:35:47+00:00,58.0,b1683032,141.3,1:54:32,1719.9,,72.7,251.4,,Ride
2499339360,Afternoon Ride super easy,37059.8,1:18:54,Ride,7.828,2019-07-02 21:47:20+00:00,38.0,b1683032,123.9,1:19:53,1151.5,,73.1,243.2,,Ride
2501081610,Lunch Swim,1000.0,0:17:58,Swim,0.928,2019-07-03 16:05:44+00:00,0.0,,,0:20:11,,,23.5,,,Swim
2501148829,Lunch Swim,800.0,0:15:35,Swim,0.856,2019-07-03 16:26:04+00:00,0.0,,,0:17:49,,,28.0,,,Swim
2506579997,Lunch Swim,2300.0,0:37:32,Swim,1.021,2019-07-05 16:00:21+00:00,0.0,,,0:43:00,,,26.4,,,Swim
2509544938,Lunch Swim,2700.0,0:49:31,Swim,0.909,2019-07-06 15:54:12+00:00,0.0,,,1:00:04,,,,,,Swim
2514993071,Lunch Swim,800.0,0:13:39,Swim,0.977,2019-07-08 16:01:39+00:00,0.0,,,0:14:28,,,24.0,,,Swim
2514993635,Lunch Swim,800.0,0:11:13,Swim,1.189,2019-07-08 16:12:13+00:00,0.0,,,0:15:58,,,29.1,,,Swim
2516299179,Afternoon Ride,56252.4,1:49:04,Ride,8.596,2019-07-08 21:41:57+00:00,56.0,b1683032,138.0,2:01:27,1867.3,,72.4,285.3,,Ride
2517910810,Lunch Swim,2700.0,0:43:40,Swim,1.031,2019-07-09 16:01:44+00:00,0.0,,,0:48:46,,,26.3,,,Swim
2519035485,Afternoon Ride,44582.3,1:35:44,Ride,7.762,2019-07-09 21:48:33+00:00,52.0,b1683032,133.9,1:39:19,1341.5,,70.3,233.5,,Ride
2523563008,Lunch Swim,3000.0,0:48:13,Swim,1.037,2019-07-11 15:57:00+00:00,0.0,,,0:50:59,,,26.5,,,Swim
2524572213,Evening Ride,42949.1,1:31:44,Ride,7.803,2019-07-11 22:18:14+00:00,50.0,b1683032,124.3,1:32:31,1310.6,,71.3,238.1,,Ride
2526102563,Lunch Swim,350.8,0:17:56,Swim,0.326,2019-07-12 15:47:05+00:00,0.0,,,0:17:56,,,24.6,,,Swim
2526103300,Lunch Swim,10.8,0:02:14,Swim,0.081,2019-07-12 16:15:24+00:00,0.0,,,0:02:14,,,,,,Swim
2526103763,Lunch Swim,187.1,0:04:57,Swim,0.63,2019-07-12 16:19:13+00:00,0.0,,,0:04:57,,,14.0,,,Swim
2527006408,Lunch Swim,178.5,0:03:50,Swim,0.776,2019-07-12 16:34:22+00:00,0.0,,,0:03:50,,,21.0,,,Swim
2529807067,Afternoon Ride,52184.3,1:54:04,Ride,7.625,2019-07-13 21:48:30+00:00,122.0,b1683032,147.2,1:55:03,1616.1,,73.8,236.1,,Ride
2534424710,Lunch Swim,1300.0,0:22:51,Swim,0.948,2019-07-15 15:49:02+00:00,0.0,,,0:41:49,,,22.8,,,Swim
2535521993,Evening Ride,44636.7,1:32:43,Ride,8.024,2019-07-15 22:56:42+00:00,44.0,b1683032,138.3,1:32:43,1360.6,,73.4,244.6,,Ride
2538503807,Evening Swim,1547.5,0:34:18,Swim,0.752,2019-07-16 23:31:31+00:00,0.0,,,0:34:18,,,28.9,,,Swim
2540310655,Lunch Swim,2150.0,0:39:54,Swim,0.898,2019-07-17 15:59:06+00:00,0.0,,,0:51:23,,,26.7,,,Swim
2541214166,Afternoon Ride,19837.0,0:40:54,Ride,8.084,2019-07-17 21:24:07+00:00,30.0,b1683032,126.2,0:42:48,633.4,,74.0,258.1,,Ride
2541371022,Evening Ride,19355.7,0:44:43,Ride,7.214,2019-07-17 23:04:14+00:00,40.0,b1683032,109.5,0:45:24,581.2,,69.2,216.6,,Ride
2543058633,Lunch Swim,2000.0,0:32:33,Swim,1.024,2019-07-18 16:02:02+00:00,0.0,,,0:41:59,,,23.4,,,Swim
2548578364,Morning Ride,161643.0,5:31:39,Ride,8.123,2019-07-20 11:10:12+00:00,510.0,b1683032,141.3,6:20:04,5035.0,,75.1,253.0,,Ride
2557886262,15 min Tabata Ride with Ally Love,8545.6,0:14:59,Ride,9.506,2019-07-23 23:53:01+00:00,0.0,b1683032,,0:14:59,176.7,,76.1,196.5,194,Ride
2557892348,15 min Tabata Ride with Ally Love,0.0,0:00:00,Ride,0.0,2019-07-24 00:09:51+00:00,0.0,b1683032,,0:00:00,,,,,,Ride
2557922691,15 min 80s Ride with Hannah Marie Corbin,9849.2,0:14:58,Ride,10.968,2019-07-24 00:12:29+00:00,0.0,b1683032,166.0,0:14:58,267.4,,82.1,297.7,297,Ride
2576044380,Morning Walk,5160.5,1:23:04,Walk,1.035,2019-07-30 14:59:48+00:00,95.0,g1453101,98.4,1:47:16,,,48.0,,,Walk
2577123873,Afternoon Walk,13326.5,3:25:44,Walk,1.08,2019-07-30 19:42:57+00:00,109.0,g1453101,98.8,4:14:12,,,47.7,,,Walk
2582867672,Evening Ride,44436.4,1:29:48,Ride,8.247,2019-08-01 22:30:15+00:00,54.0,b1683032,153.1,1:33:29,1404.2,,75.0,260.6,,Ride
2587226572,Morning Ride,78733.7,2:29:32,Ride,8.775,2019-08-03 13:04:21+00:00,125.0,b1683032,154.6,2:36:37,2612.8,,75.5,291.2,,Ride
2590701763,Lunch Swim,2000.0,0:35:01,Swim,0.952,2019-08-04 15:55:13+00:00,0.0,,,0:49:33,,,23.4,,,Swim
2590691971,Lunch Swim,500.0,0:06:43,Swim,1.241,2019-08-04 16:39:42+00:00,0.0,,,0:07:49,,,23.6,,,Swim
2594210165,Afternoon Ride,42280.4,1:26:55,Ride,8.107,2019-08-05 21:46:21+00:00,59.0,b1683032,152.2,1:26:55,1359.4,,74.1,260.7,,Ride
2617108356,MIght MAC Swim,6920.2,1:57:00,Swim,0.986,2019-08-11 11:00:00+00:00,0.0,,,1:57:00,,,,,,Swim
2616896908,Afternoon Ride,26786.0,0:50:05,Ride,8.914,2019-08-13 21:49:35+00:00,28.0,b1683032,154.8,0:51:01,886.0,,79.3,294.8,,Ride
2616897466,Evening Ride,18540.5,0:42:27,Ride,7.279,2019-08-13 22:41:00+00:00,27.0,b1683032,144.1,0:43:02,545.9,,75.8,214.3,,Ride
2619875260,45 min Tabata Ride with Robin Arzon,20486.9,0:43:03,Ride,7.931,2019-08-15 00:33:50+00:00,0.0,b5274657,,0:43:03,392.6,,69.7,152.0,175,Ride
2621660077,Lunch Swim,1050.0,0:16:50,Swim,1.04,2019-08-15 16:11:09+00:00,0.0,,,0:20:19,,,23.1,,,Swim
2626940789,Morning Ride,62022.6,1:54:37,Ride,9.019,2019-08-17 12:32:52+00:00,97.0,b1683032,149.8,2:14:42,2172.7,,79.6,315.9,,Ride
2627036983,Morning Ride,9148.0,0:21:11,Ride,7.197,2019-08-17 14:54:42+00:00,22.0,b1683032,139.3,0:21:27,283.4,,68.4,223.0,,Ride
2627734067,Lunch Swim,550.0,0:16:18,Swim,0.562,2019-08-17 15:58:53+00:00,0.0,,,0:26:18,,,22.0,,,Swim
2631347517,Evening Ride,29729.3,1:02:46,Ride,7.894,2019-08-18 23:23:16+00:00,33.0,b1683032,126.2,1:02:46,921.2,,72.2,244.6,,Ride
2633866417,Afternoon Ride,49959.0,1:45:29,Ride,7.894,2019-08-19 21:44:58+00:00,56.0,b1683032,140.0,1:47:17,1590.9,,74.0,251.4,,Ride
2635696510,Lunch Swim,1150.0,0:19:02,Swim,1.007,2019-08-20 15:54:12+00:00,0.0,,,0:21:36,,,25.1,,,Swim
2635760592,Lunch Swim,1300.0,0:19:23,Swim,1.118,2019-08-20 16:20:02+00:00,0.0,,,0:27:16,,,27.1,,,Swim
2638821819,Lunch Swim,2100.0,0:35:09,Swim,0.996,2019-08-21 16:04:11+00:00,0.0,,,0:52:09,,,25.8,,,Swim
2639947683,Evening Ride,45429.0,1:32:46,Ride,8.162,2019-08-21 22:38:14+00:00,28.0,b1683032,139.2,1:33:52,1440.6,,74.9,258.8,,Ride
2639982858,Evening Ride,8949.6,0:20:58,Ride,7.114,2019-08-22 00:12:39+00:00,20.0,b1683032,130.6,0:20:58,280.1,,71.8,222.6,,Ride
2641725164,Lunch Swim,1950.0,0:30:31,Swim,1.065,2019-08-22 16:02:33+00:00,0.0,,,0:42:31,,,28.0,,,Swim
2644564251,Lunch Swim,1200.0,0:36:55,Swim,0.542,2019-08-23 15:53:00+00:00,0.0,,,0:48:28,,,29.8,,,Swim
2653510942,Lunch Swim,2900.0,0:44:50,Swim,1.078,2019-08-26 15:56:09+00:00,0.0,,,0:56:19,,,26.8,,,Swim
2664850610,Lunch Swim,300.0,0:07:03,Swim,0.709,2019-08-30 15:50:51+00:00,0.0,,,0:07:11,,,,,,Swim
2671968501,Afternoon Ride,53234.1,1:46:22,Ride,8.341,2019-09-01 17:35:28+00:00,95.0,b1683032,154.8,1:56:23,1814.1,,80.5,284.3,,Ride
2671969430,Afternoon Ride,53015.1,1:52:23,Ride,7.862,2019-09-01 19:40:05+00:00,42.0,b1683032,151.6,2:08:20,1588.7,,76.4,235.6,,Ride
2677848888,30 min Sweat Steady Ride with Jess King,17928.1,0:29:58,Ride,9.971,2019-09-04 00:03:35+00:00,0.0,b5274657,,0:29:58,406.3,,73.9,226.0,229,Ride
2677883084,15 min Tabata Ride with Ally Love,4103.8,0:10:15,Ride,6.673,2019-09-04 00:38:34+00:00,0.0,b5274657,,0:10:15,60.3,,58.3,98.0,108,Ride
2683791520,Evening Ride,36666.0,1:14:31,Ride,8.201,2019-09-05 22:37:05+00:00,38.0,b1683032,135.6,1:14:54,1186.7,,73.9,265.4,,Ride
2747522112,Morning Ride,175137.0,6:25:02,Ride,7.581,2019-09-28 11:35:39+00:00,559.0,b1683032,151.9,8:18:14,5376.6,,69.9,232.7,,Ride
2750833203,Morning Ride,161117.0,6:12:18,Ride,7.213,2019-09-29 11:44:25+00:00,256.0,b1683032,132.7,7:44:32,4749.3,,66.9,212.6,,Ride
2797045685,Afternoon Ride,37032.0,1:22:53,Ride,7.447,2019-10-17 21:50:06+00:00,77.0,b1683032,152.7,1:26:32,1172.3,,68.5,235.7,,Ride
2798954101,Afternoon Ride,44015.2,1:35:16,Ride,7.7,2019-10-18 19:25:45+00:00,56.0,b1683032,142.7,1:36:00,1363.9,,73.1,238.6,,Ride
2800910233,Lunch Walk,1177.4,0:15:47,Walk,1.243,2019-10-19 15:20:27+00:00,6.0,g1453101,98.0,0:23:24,,,49.0,,,Walk
2804275707,Lunch Ride,54277.6,1:53:12,Ride,7.991,2019-10-20 15:53:29+00:00,65.0,b1683032,146.3,1:56:44,1706.2,,74.6,251.2,,Ride
2814602854,Afternoon Ride,45947.3,1:41:37,Ride,7.536,2019-10-24 21:23:55+00:00,49.0,b1683032,137.8,1:42:04,1386.0,,74.3,227.3,,Ride
2822419006,Afternoon Ride,65580.1,2:19:12,Ride,7.852,2019-10-27 19:20:43+00:00,147.9,b1683032,,2:21:38,2201.5,,,263.6,,Ride
2850919593,45 min Live DJ Ride with Robin Arzon,21838.7,0:44:59,Ride,8.091,2019-11-08 23:00:52+00:00,0.0,b5274657,85.6,0:44:59,402.7,,74.0,149.2,158,Ride
2858689867,30 min HRZ Max Capacity Ride with Jennifer Jacobs,17831.5,0:30:04,Ride,9.884,2019-11-12 00:04:29+00:00,0.0,b5274657,6.1,0:30:04,404.5,,77.1,224.2,228,Ride
2865571007,45 min Low Impact Ride with Hannah Marie Corbin,26087.4,0:44:57,Ride,9.673,2019-11-15 00:50:22+00:00,0.0,b5274657,132.7,0:44:57,567.0,,73.6,210.2,216,Ride
2869395206,45 min Sweat Steady Ride with Jess King,22917.0,0:41:35,Ride,9.185,2019-11-16 16:52:40+00:00,0.0,b5274657,129.6,0:41:35,451.3,,73.7,180.9,181,Ride
2882260386,45 min Classic Rock Ride with Jess King,24075.7,0:44:58,Ride,8.924,2019-11-22 00:37:31+00:00,0.0,b5274657,,0:44:58,548.0,,71.6,203.1,225,Ride
2883985527,45 min Classic Rock Ride with Hannah Marie Corbin,24059.6,0:44:57,Ride,8.921,2019-11-22 21:57:38+00:00,0.0,b5274657,,0:44:57,473.1,,74.5,175.4,181,Ride
2894034810,20 min 90s Pop Ride with Hannah Marie Corbin,12906.9,0:19:58,Ride,10.774,2019-11-26 23:54:50+00:00,0.0,b5274657,,0:19:58,332.8,,74.0,277.8,278,Ride
2894060471,15 min 90s Rock Ride with Emma Lovewell,7354.7,0:14:46,Ride,8.301,2019-11-27 00:17:20+00:00,0.0,b1683032,133.0,0:14:46,123.3,,70.1,139.2,139,Ride
2894070652,5 min Cool Down Ride with Jess King,3009.5,0:04:57,Ride,10.133,2019-11-27 00:34:23+00:00,0.0,b5274657,,0:04:57,69.4,,76.5,233.7,223,Ride
2896131222,45 min Pop Ride with Hannah Marie Corbin,23126.2,0:44:58,Ride,8.572,2019-11-27 22:13:28+00:00,0.0,b5274657,106.8,0:44:58,410.2,,72.0,152.0,152,Ride
2898338023,Afternoon Ride,52982.5,1:54:01,Ride,7.745,2019-11-28 20:19:29+00:00,55.0,b1683032,156.9,1:54:34,1607.7,,73.3,235.0,,Ride
2902223199,60 min Hip Hop Ride with Hannah Frankson,31961.5,0:59:57,Ride,8.886,2019-11-30 16:35:23+00:00,0.0,b5274657,64.1,0:59:57,608.6,,70.3,169.2,175,Ride
2909711925,30 min Pop Ride with Olivia Amato,17252.1,0:29:57,Ride,9.601,2019-12-04 00:31:01+00:00,0.0,b5274657,,0:29:57,363.4,,77.4,202.2,203,Ride
2914052560,20 min HIIT Ride with Hannah Marie Corbin,12713.8,0:19:57,Ride,10.621,2019-12-06 00:25:17+00:00,0.0,b5274657,,0:19:57,323.0,,77.1,269.9,270,Ride
2914067046,10 min Warm Up Ride with Kendall Toole,4425.7,0:09:57,Ride,7.413,2019-12-06 00:47:41+00:00,0.0,b5274657,,0:09:57,69.8,,64.9,116.9,122,Ride
2915866935,45 min Intervals & Arms Ride with Hannah Marie Corbin,24639.0,0:44:57,Ride,9.136,2019-12-06 22:51:12+00:00,0.0,b5274657,61.6,0:44:57,478.9,,74.7,177.6,177,Ride
2917744733,45 min 60s Ride with Hannah Marie Corbin,26731.1,0:44:58,Ride,9.908,2019-12-07 16:51:38+00:00,0.0,b5274657,,0:44:58,608.0,,75.7,225.3,227,Ride
2925183546,30 min Advanced Beginner Ride with Hannah Marie Corbin,18829.3,0:29:58,Ride,10.472,2019-12-11 00:27:58+00:00,0.0,b5274657,,0:29:58,462.4,,72.9,257.2,264,Ride
2929355293,45 min 70s Ride with Hannah Marie Corbin,28115.2,0:46:02,Ride,10.179,2019-12-13 00:30:52+00:00,0.0,b5274657,,0:46:02,671.1,,73.5,243.0,253,Ride
2947802679,Afternoon Ride,36940.6,1:18:33,Ride,7.838,2019-12-21 20:37:13+00:00,45.0,b1683032,140.3,1:19:43,1166.4,,77.9,247.5,,Ride
2958882391,60 min Classic Rock Ride with Hannah Marie Corbin,33071.9,0:59:58,Ride,9.192,2019-12-26 23:48:19+00:00,0.0,b5274657,,0:59:58,709.7,,67.1,197.3,207,Ride
